{"txts": ["项目名称:卡式血型+抗体筛查", "◆", "◆", "◆", "◆", "◆", "◆", "◆", "◆", "◆", "标本种类:EDTA抗凝血", "◆", "◆", "◆", "◆", "◆", "No 项目名称", "结果", "参考区间", "单位", "◆", "1", "ABO血型鉴定(ABO血型)", "B型", "2", "RH血型鉴定(RH血型)", "RhD(+)", "3", "抗体筛查", "阴性", "◆", "◆", "◆", "◆", "◆", "◆", "◆", "◆", "◆"], "boxes": [[[56.0, 18.0], [396.0, 18.0], [396.0, 47.0], [56.0, 47.0]], [[1289.0, 15.0], [1422.0, 15.0], [1422.0, 45.0], [1289.0, 45.0]], [[339.0, 42.0], [1043.0, 42.0], [1043.0, 87.0], [339.0, 87.0]], [[1332.0, 48.0], [1389.0, 48.0], [1389.0, 81.0], [1332.0, 81.0]], [[54.0, 87.0], [191.0, 85.0], [191.0, 123.0], [54.0, 125.0]], [[342.0, 94.0], [572.0, 94.0], [572.0, 121.0], [342.0, 121.0]], [[727.0, 94.0], [984.0, 94.0], [984.0, 121.0], [727.0, 121.0]], [[1087.0, 93.0], [1423.0, 93.0], [1423.0, 122.0], [1087.0, 122.0]], [[55.0, 122.0], [160.0, 122.0], [160.0, 156.0], [55.0, 156.0]], [[338.0, 123.0], [548.0, 123.0], [548.0, 156.0], [338.0, 156.0]], [[726.0, 123.0], [983.0, 123.0], [983.0, 153.0], [726.0, 153.0]], [[1086.0, 123.0], [1294.0, 123.0], [1294.0, 153.0], [1086.0, 153.0]], [[57.0, 157.0], [183.0, 157.0], [183.0, 187.0], [57.0, 187.0]], [[336.0, 156.0], [472.0, 156.0], [472.0, 189.0], [336.0, 189.0]], [[727.0, 158.0], [973.0, 158.0], [973.0, 187.0], [727.0, 187.0]], [[1088.0, 158.0], [1348.0, 158.0], [1348.0, 187.0], [1088.0, 187.0]], [[65.0, 193.0], [204.0, 193.0], [204.0, 223.0], [65.0, 223.0]], [[574.0, 193.0], [628.0, 193.0], [628.0, 223.0], [574.0, 223.0]], [[839.0, 194.0], [937.0, 194.0], [937.0, 222.0], [839.0, 222.0]], [[1095.0, 193.0], [1149.0, 193.0], [1149.0, 223.0], [1095.0, 223.0]], [[1298.0, 194.0], [1397.0, 194.0], [1397.0, 222.0], [1298.0, 222.0]], [[68.0, 231.0], [90.0, 231.0], [90.0, 254.0], [68.0, 254.0]], [[103.0, 229.0], [337.0, 229.0], [337.0, 256.0], [103.0, 256.0]], [[578.0, 227.0], [623.0, 227.0], [623.0, 258.0], [578.0, 258.0]], [[67.0, 258.0], [89.0, 258.0], [89.0, 282.0], [67.0, 282.0]], [[103.0, 256.0], [315.0, 256.0], [315.0, 283.0], [103.0, 283.0]], [[555.0, 254.0], [643.0, 254.0], [643.0, 285.0], [555.0, 285.0]], [[67.0, 285.0], [88.0, 285.0], [88.0, 308.0], [67.0, 308.0]], [[103.0, 283.0], [203.0, 283.0], [203.0, 310.0], [103.0, 310.0]], [[572.0, 280.0], [630.0, 280.0], [630.0, 313.0], [572.0, 313.0]], [[85.0, 902.0], [157.0, 902.0], [157.0, 938.0], [85.0, 938.0]], [[57.0, 942.0], [374.0, 942.0], [374.0, 968.0], [57.0, 968.0]], [[539.0, 942.0], [850.0, 942.0], [850.0, 968.0], [539.0, 968.0]], [[1037.0, 942.0], [1354.0, 942.0], [1354.0, 968.0], [1037.0, 968.0]], [[57.0, 975.0], [419.0, 975.0], [419.0, 1001.0], [57.0, 1001.0]], [[474.0, 975.0], [941.0, 975.0], [941.0, 1001.0], [474.0, 1001.0]], [[1036.0, 968.0], [1463.0, 968.0], [1463.0, 1008.0], [1036.0, 1008.0]], [[56.0, 1008.0], [1022.0, 1008.0], [1022.0, 1036.0], [56.0, 1036.0]], [[57.0, 1035.0], [661.0, 1035.0], [661.0, 1061.0], [57.0, 1061.0]]], "scores": [0.99828, 0.99993, 0.99996, 0.99953, 0.97772, 0.97563, 0.98027, 0.99777, 0.90577, 0.96645, 0.98611, 0.99662, 0.93873, 0.9674, 0.98928, 0.97171, 0.97206, 0.99986, 0.99971, 0.99952, 0.99966, 0.99957, 0.99605, 0.99986, 0.99992, 0.99741, 0.99755, 0.99999, 0.99993, 0.99977, 0.99907, 0.97471, 0.98747, 0.97577, 0.99979, 0.98758, 0.96116, 0.99514, 0.99975], "elapse": 1.0113421669229865, "elapse_list": [0.29034449998289347, 0.022366292076185346, 0.6986313748639077], "engine": "onnxruntime", "model_info": {"det": "PP-OCRv6_small", "cls": "PP-OCRv4_mobile", "rec": "PP-OCRv6_small"}}
