{"txts": ["项目名称:肝纤维化系列", "◆", "◆", "◆", "◆", "◆", "◆", "◆", "◆", "◆", "◆", "◆", "◆", "◆", "◆", "◆", "No 项目名称", "结果", "参考区间", "单位", "◆", "透明质酸(HA)", "<50.0000", "<110", "μg/L", "◆", "2", "层粘连蛋白(LN)", "58.0800", "<130.00", "μg/L", "◆", "3", "三型前胶原N端肽(PIIINP)", "6.1700", "<15.00", "μg/L", "◆", "4", "四型前胶原(IV-Col)", "98.6000", "←", "<96.00", "μg/L", "◆", "◆", "◆", "◆", "◆", "◆", "◆", "◆", "◆", "◆", "◆"], "boxes": [[[57.0, 19.0], [329.0, 19.0], [329.0, 46.0], [57.0, 46.0]], [[1289.0, 15.0], [1422.0, 15.0], [1422.0, 45.0], [1289.0, 45.0]], [[341.0, 43.0], [1042.0, 43.0], [1042.0, 85.0], [341.0, 85.0]], [[1332.0, 48.0], [1389.0, 48.0], [1389.0, 81.0], [1332.0, 81.0]], [[54.0, 87.0], [191.0, 85.0], [191.0, 122.0], [54.0, 124.0]], [[342.0, 94.0], [572.0, 94.0], [572.0, 121.0], [342.0, 121.0]], [[726.0, 92.0], [985.0, 92.0], [985.0, 122.0], [726.0, 122.0]], [[1087.0, 93.0], [1423.0, 93.0], [1423.0, 122.0], [1087.0, 122.0]], [[55.0, 122.0], [160.0, 122.0], [160.0, 156.0], [55.0, 156.0]], [[338.0, 123.0], [546.0, 123.0], [546.0, 153.0], [338.0, 153.0]], [[727.0, 124.0], [908.0, 124.0], [908.0, 154.0], [727.0, 154.0]], [[1088.0, 124.0], [1295.0, 124.0], [1295.0, 154.0], [1088.0, 154.0]], [[57.0, 157.0], [183.0, 157.0], [183.0, 187.0], [57.0, 187.0]], [[335.0, 155.0], [471.0, 155.0], [471.0, 188.0], [335.0, 188.0]], [[726.0, 157.0], [971.0, 157.0], [971.0, 186.0], [726.0, 186.0]], [[1087.0, 158.0], [1347.0, 158.0], [1347.0, 187.0], [1087.0, 187.0]], [[66.0, 193.0], [205.0, 193.0], [205.0, 223.0], [66.0, 223.0]], [[573.0, 193.0], [629.0, 193.0], [629.0, 223.0], [573.0, 223.0]], [[839.0, 194.0], [937.0, 194.0], [937.0, 222.0], [839.0, 222.0]], [[1093.0, 191.0], [1151.0, 191.0], [1151.0, 224.0], [1093.0, 224.0]], [[1298.0, 194.0], [1397.0, 194.0], [1397.0, 222.0], [1298.0, 222.0]], [[99.0, 229.0], [245.0, 229.0], [245.0, 256.0], [99.0, 256.0]], [[549.0, 229.0], [657.0, 229.0], [657.0, 256.0], [549.0, 256.0]], [[861.0, 228.0], [916.0, 228.0], [916.0, 257.0], [861.0, 257.0]], [[1092.0, 227.0], [1156.0, 227.0], [1156.0, 259.0], [1092.0, 259.0]], [[1286.0, 226.0], [1409.0, 228.0], [1408.0, 259.0], [1285.0, 257.0]], [[67.0, 258.0], [87.0, 258.0], [87.0, 283.0], [67.0, 283.0]], [[106.0, 256.0], [269.0, 256.0], [269.0, 283.0], [106.0, 283.0]], [[556.0, 256.0], [645.0, 256.0], [645.0, 284.0], [556.0, 284.0]], [[844.0, 256.0], [932.0, 256.0], [932.0, 284.0], [844.0, 284.0]], [[1091.0, 254.0], [1155.0, 252.0], [1156.0, 284.0], [1092.0, 287.0]], [[1286.0, 253.0], [1408.0, 255.0], [1407.0, 286.0], [1285.0, 283.0]], [[66.0, 284.0], [86.0, 284.0], [86.0, 309.0], [66.0, 309.0]], [[105.0, 283.0], [371.0, 283.0], [371.0, 309.0], [105.0, 309.0]], [[560.0, 283.0], [641.0, 283.0], [641.0, 310.0], [560.0, 310.0]], [[850.0, 283.0], [927.0, 283.0], [927.0, 310.0], [850.0, 310.0]], [[1092.0, 282.0], [1156.0, 282.0], [1156.0, 313.0], [1092.0, 313.0]], [[1286.0, 282.0], [1409.0, 282.0], [1409.0, 311.0], [1286.0, 311.0]], [[67.0, 311.0], [88.0, 311.0], [88.0, 335.0], [67.0, 335.0]], [[106.0, 310.0], [316.0, 310.0], [316.0, 336.0], [106.0, 336.0]], [[556.0, 310.0], [645.0, 310.0], [645.0, 337.0], [556.0, 337.0]], [[725.0, 311.0], [740.0, 311.0], [740.0, 335.0], [725.0, 335.0]], [[850.0, 309.0], [927.0, 309.0], [927.0, 337.0], [850.0, 337.0]], [[1092.0, 308.0], [1156.0, 308.0], [1156.0, 340.0], [1092.0, 340.0]], [[1286.0, 308.0], [1408.0, 308.0], [1408.0, 338.0], [1286.0, 338.0]], [[85.0, 902.0], [157.0, 902.0], [157.0, 938.0], [85.0, 938.0]], [[57.0, 942.0], [374.0, 942.0], [374.0, 968.0], [57.0, 968.0]], [[539.0, 942.0], [850.0, 942.0], [850.0, 968.0], [539.0, 968.0]], [[1037.0, 941.0], [1355.0, 941.0], [1355.0, 968.0], [1037.0, 968.0]], [[56.0, 973.0], [420.0, 973.0], [420.0, 1002.0], [56.0, 1002.0]], [[473.0, 973.0], [942.0, 973.0], [942.0, 1002.0], [473.0, 1002.0]], [[1037.0, 968.0], [1135.0, 970.0], [1134.0, 1005.0], [1036.0, 1002.0]], [[1131.0, 964.0], [1452.0, 964.0], [1452.0, 1017.0], [1131.0, 1017.0]], [[56.0, 1007.0], [1021.0, 1007.0], [1021.0, 1035.0], [56.0, 1035.0]], [[57.0, 1035.0], [661.0, 1035.0], [661.0, 1061.0], [57.0, 1061.0]]], "scores": [0.99066, 0.99993, 0.99995, 0.99948, 0.96423, 0.97116, 0.97357, 0.99363, 0.89839, 0.96676, 0.97616, 0.97824, 0.97424, 0.98501, 0.98744, 0.97969, 0.98362, 0.99988, 0.99965, 0.99954, 0.99993, 0.99884, 0.99948, 0.99958, 0.98076, 0.99994, 0.99995, 0.99932, 0.99999, 0.99991, 0.95189, 0.99988, 0.99999, 0.99954, 1.0, 0.99992, 0.97345, 0.9999, 0.99999, 0.99623, 0.99999, 0.9867, 0.99992, 0.96703, 0.99995, 0.99905, 0.99146, 0.97888, 0.97346, 0.99787, 0.97246, 0.9134, 0.79054, 0.9947, 0.99984], "elapse": 1.1304665408097208, "elapse_list": [0.27645549993030727, 0.02978070778772235, 0.8242303330916911], "engine": "onnxruntime", "model_info": {"det": "PP-OCRv6_small", "cls": "PP-OCRv4_mobile", "rec": "PP-OCRv6_small"}}
