{"txts": ["项目名称:抗核抗体滴度(IIF)", "◆", "◆", "◆", "◆", "◆", "◆", "◆", "◆", "◆", "◆", "◆", "◆", "◆", "◆", "◆", "No 项目名称", "结果", "参考区间", "单位", "◆", "1", "ANA(I IF)(ANA(IIF))", "阳性(+)", "↑", "阴性(-)", "◆", "2", "抗核抗体主荧光核型(ZHX2)", "核均质型", "◆", "3", "◆", "阳性(+)", "←", "4", "◆", "阴性(一)", "5", "◆", "阴性(一)", "6", "◆", "阴性(一)", "7", "◆", "阴性(一)", "◆", "◆", "◆", "◆", "◆", "◆", "◆", "◆", "◆", "◆", "◆"], "boxes": [[[56.0, 18.0], [390.0, 18.0], [390.0, 47.0], [56.0, 47.0]], [[1289.0, 15.0], [1422.0, 15.0], [1422.0, 45.0], [1289.0, 45.0]], [[339.0, 42.0], [1043.0, 42.0], [1043.0, 87.0], [339.0, 87.0]], [[1332.0, 48.0], [1389.0, 48.0], [1389.0, 81.0], [1332.0, 81.0]], [[54.0, 87.0], [191.0, 85.0], [191.0, 123.0], [54.0, 125.0]], [[341.0, 94.0], [572.0, 94.0], [572.0, 121.0], [341.0, 121.0]], [[727.0, 94.0], [984.0, 94.0], [984.0, 121.0], [727.0, 121.0]], [[1087.0, 93.0], [1424.0, 93.0], [1424.0, 122.0], [1087.0, 122.0]], [[55.0, 122.0], [160.0, 122.0], [160.0, 156.0], [55.0, 156.0]], [[338.0, 123.0], [548.0, 123.0], [548.0, 156.0], [338.0, 156.0]], [[727.0, 124.0], [908.0, 124.0], [908.0, 154.0], [727.0, 154.0]], [[1086.0, 123.0], [1294.0, 123.0], [1294.0, 153.0], [1086.0, 153.0]], [[57.0, 157.0], [183.0, 157.0], [183.0, 187.0], [57.0, 187.0]], [[336.0, 156.0], [472.0, 156.0], [472.0, 189.0], [336.0, 189.0]], [[726.0, 158.0], [972.0, 158.0], [972.0, 187.0], [726.0, 187.0]], [[1085.0, 156.0], [1207.0, 156.0], [1207.0, 189.0], [1085.0, 189.0]], [[67.0, 193.0], [204.0, 193.0], [204.0, 223.0], [67.0, 223.0]], [[573.0, 193.0], [629.0, 193.0], [629.0, 223.0], [573.0, 223.0]], [[839.0, 194.0], [937.0, 194.0], [937.0, 222.0], [839.0, 222.0]], [[1095.0, 193.0], [1149.0, 193.0], [1149.0, 223.0], [1095.0, 223.0]], [[1297.0, 194.0], [1396.0, 194.0], [1396.0, 222.0], [1297.0, 222.0]], [[69.0, 232.0], [87.0, 232.0], [87.0, 252.0], [69.0, 252.0]], [[103.0, 229.0], [316.0, 229.0], [316.0, 256.0], [103.0, 256.0]], [[551.0, 227.0], [649.0, 227.0], [649.0, 258.0], [551.0, 258.0]], [[724.0, 229.0], [743.0, 229.0], [743.0, 256.0], [724.0, 256.0]], [[842.0, 227.0], [930.0, 227.0], [930.0, 258.0], [842.0, 258.0]], [[1264.0, 229.0], [1430.0, 229.0], [1430.0, 256.0], [1264.0, 256.0]], [[67.0, 258.0], [87.0, 258.0], [87.0, 282.0], [67.0, 282.0]], [[105.0, 256.0], [383.0, 256.0], [383.0, 283.0], [105.0, 283.0]], [[553.0, 256.0], [650.0, 256.0], [650.0, 284.0], [553.0, 284.0]], [[1264.0, 257.0], [1430.0, 257.0], [1430.0, 284.0], [1264.0, 284.0]], [[68.0, 286.0], [86.0, 286.0], [86.0, 309.0], [68.0, 309.0]], [[101.0, 284.0], [169.0, 281.0], [171.0, 310.0], [102.0, 313.0]], [[553.0, 283.0], [648.0, 283.0], [648.0, 310.0], [553.0, 310.0]], [[725.0, 284.0], [741.0, 284.0], [741.0, 308.0], [725.0, 308.0]], [[67.0, 312.0], [87.0, 312.0], [87.0, 336.0], [67.0, 336.0]], [[103.0, 310.0], [170.0, 310.0], [170.0, 338.0], [103.0, 338.0]], [[552.0, 309.0], [648.0, 309.0], [648.0, 337.0], [552.0, 337.0]], [[69.0, 340.0], [86.0, 340.0], [86.0, 362.0], [69.0, 362.0]], [[103.0, 337.0], [181.0, 337.0], [181.0, 365.0], [103.0, 365.0]], [[552.0, 335.0], [649.0, 335.0], [649.0, 366.0], [552.0, 366.0]], [[69.0, 367.0], [86.0, 367.0], [86.0, 389.0], [69.0, 389.0]], [[103.0, 364.0], [182.0, 364.0], [182.0, 392.0], [103.0, 392.0]], [[551.0, 362.0], [649.0, 362.0], [649.0, 393.0], [551.0, 393.0]], [[69.0, 394.0], [86.0, 394.0], [86.0, 416.0], [69.0, 416.0]], [[104.0, 392.0], [192.0, 392.0], [192.0, 419.0], [104.0, 419.0]], [[552.0, 391.0], [647.0, 391.0], [647.0, 419.0], [552.0, 419.0]], [[85.0, 902.0], [157.0, 902.0], [157.0, 938.0], [85.0, 938.0]], [[57.0, 942.0], [374.0, 942.0], [374.0, 968.0], [57.0, 968.0]], [[539.0, 942.0], [850.0, 942.0], [850.0, 968.0], [539.0, 968.0]], [[1037.0, 940.0], [1148.0, 942.0], [1147.0, 970.0], [1036.0, 968.0]], [[1135.0, 942.0], [1355.0, 942.0], [1355.0, 968.0], [1135.0, 968.0]], [[57.0, 975.0], [419.0, 975.0], [419.0, 1001.0], [57.0, 1001.0]], [[474.0, 975.0], [941.0, 975.0], [941.0, 1001.0], [474.0, 1001.0]], [[1038.0, 970.0], [1132.0, 970.0], [1132.0, 1001.0], [1038.0, 1001.0]], [[1142.0, 967.0], [1457.0, 970.0], [1457.0, 1011.0], [1142.0, 1007.0]], [[56.0, 1008.0], [1022.0, 1008.0], [1022.0, 1036.0], [56.0, 1036.0]], [[57.0, 1035.0], [661.0, 1035.0], [661.0, 1061.0], [57.0, 1061.0]]], "scores": [0.99132, 0.99993, 0.99982, 0.99951, 0.975, 0.98002, 0.96792, 0.99294, 0.92686, 0.94853, 0.99339, 0.99934, 0.97135, 0.95502, 0.98898, 0.98663, 0.98099, 0.99989, 0.99962, 0.99952, 0.99997, 0.99978, 0.96772, 0.93188, 0.9976, 0.97674, 0.99994, 0.99995, 0.99955, 0.99999, 0.99991, 1.0, 0.99963, 0.96123, 0.99329, 0.99999, 0.99984, 0.91633, 0.99999, 0.99974, 0.94767, 0.99997, 0.99986, 0.94936, 0.99998, 0.99982, 0.928, 0.99917, 0.98261, 0.97091, 0.99271, 0.99614, 0.99975, 0.985, 0.97525, 0.90987, 0.99543, 0.99978], "elapse": 1.1173335819039494, "elapse_list": [0.26865779096260667, 0.03595683304592967, 0.812718957895413], "engine": "onnxruntime", "model_info": {"det": "PP-OCRv6_small", "cls": "PP-OCRv4_mobile", "rec": "PP-OCRv6_small"}}
