{
  "txts": ["血红蛋白", "128", "g/L"],
  "boxes": [[[100, 200], [180, 200], [180, 230], [100, 230]], [[300, 200], [360, 200], [360, 230], [300, 230]], [[400, 200], [460, 200], [460, 230], [400, 230]]],
  "scores": [0.99, 0.98, 0.97],
  "elapse": 1.23,
  "elapse_list": [0.4, 0.05, 0.78],
  "engine": "onnxruntime",
  "model_info": {"det": "PP-OCRv6_small", "cls": "PP-OCRv4_mobile", "rec": "PP-OCRv6_small"}
}
