{"txts": ["项目名称:自免肝抗体谱（IIF+流式荧光）", "◆", "◆", "◆", "◆", "◆", "◆", "◆", "◆", "◆", "◆", "◆", "◆", "◆", "◆", "◆", "No 项目名称", "结果", "参考区间", "单位", "◆", "1", "ANA(IIF)(ANA(IIF))", "阳性(+)", "↑", "阴性(-)", "◆", "2", "抗核抗体主荧光核型(ZHX2)", "核均质型", "◆", "3", "抗线粒体抗体(AMA)", "阴性(一)", "阴性(-)", "◆", "4", "抗平滑肌抗体(ASMA)", "阴性(一)", "阴性(-)", "◆", "5", "◆", "阴性(一)", "阴性(-)", "◆", "11", "抗sp100抗体(sp100)", "0.70", "<20", "AU", "◆", "7", "抗LC—1抗体(LC-1)", "0.19", "<20", "AU", "◆", "8", "抗LKM—1抗体(LKM-1)", "0.24", "<20", "AU", "◆", "9", "抗SLA/LP抗体(SLA/LP)", "2.43", "<20", "AU", "◆", "6", "抗AMA—M2—3E抗体(AMA-M2-3E)", "0.19", "<20", "U/mL", "◆", "10 抗gp210抗体(gp210)", "0.29", "<20", "AU", "◆", "◆", "◆", "◆", "◆", "◆", "◆", "◆", "◆", "◆"], "boxes": [[[55.0, 16.0], [526.0, 17.0], [526.0, 48.0], [55.0, 47.0]], [[1289.0, 15.0], [1421.0, 15.0], [1421.0, 45.0], [1289.0, 45.0]], [[338.0, 42.0], [1043.0, 40.0], [1043.0, 85.0], [339.0, 87.0]], [[1332.0, 48.0], [1389.0, 48.0], [1389.0, 81.0], [1332.0, 81.0]], [[54.0, 86.0], [191.0, 84.0], [191.0, 122.0], [54.0, 124.0]], [[342.0, 94.0], [572.0, 94.0], [572.0, 121.0], [342.0, 121.0]], [[726.0, 92.0], [985.0, 92.0], [985.0, 122.0], [726.0, 122.0]], [[1087.0, 93.0], [1424.0, 93.0], [1424.0, 122.0], [1087.0, 122.0]], [[54.0, 121.0], [158.0, 121.0], [158.0, 155.0], [54.0, 155.0]], [[338.0, 123.0], [546.0, 123.0], [546.0, 153.0], [338.0, 153.0]], [[727.0, 124.0], [908.0, 124.0], [908.0, 154.0], [727.0, 154.0]], [[1088.0, 124.0], [1295.0, 124.0], [1295.0, 154.0], [1088.0, 154.0]], [[57.0, 157.0], [182.0, 157.0], [182.0, 187.0], [57.0, 187.0]], [[335.0, 154.0], [474.0, 154.0], [474.0, 190.0], [335.0, 190.0]], [[727.0, 158.0], [972.0, 158.0], [972.0, 187.0], [727.0, 187.0]], [[1088.0, 158.0], [1308.0, 158.0], [1308.0, 187.0], [1088.0, 187.0]], [[66.0, 193.0], [204.0, 193.0], [204.0, 223.0], [66.0, 223.0]], [[572.0, 191.0], [630.0, 191.0], [630.0, 224.0], [572.0, 224.0]], [[838.0, 192.0], [938.0, 192.0], [938.0, 223.0], [838.0, 223.0]], [[1094.0, 191.0], [1150.0, 191.0], [1150.0, 224.0], [1094.0, 224.0]], [[1297.0, 192.0], [1398.0, 192.0], [1398.0, 223.0], [1297.0, 223.0]], [[69.0, 232.0], [87.0, 232.0], [87.0, 252.0], [69.0, 252.0]], [[105.0, 229.0], [316.0, 229.0], [316.0, 256.0], [105.0, 256.0]], [[551.0, 227.0], [649.0, 227.0], [649.0, 258.0], [551.0, 258.0]], [[724.0, 229.0], [743.0, 229.0], [743.0, 256.0], [724.0, 256.0]], [[843.0, 227.0], [930.0, 227.0], [930.0, 258.0], [843.0, 258.0]], [[1264.0, 229.0], [1430.0, 229.0], [1430.0, 256.0], [1264.0, 256.0]], [[67.0, 257.0], [87.0, 257.0], [87.0, 282.0], [67.0, 282.0]], [[106.0, 256.0], [383.0, 256.0], [383.0, 283.0], [106.0, 283.0]], [[552.0, 252.0], [650.0, 254.0], [649.0, 285.0], [551.0, 282.0]], [[1264.0, 256.0], [1430.0, 256.0], [1430.0, 283.0], [1264.0, 283.0]], [[68.0, 285.0], [86.0, 285.0], [86.0, 308.0], [68.0, 308.0]], [[106.0, 283.0], [304.0, 283.0], [304.0, 309.0], [106.0, 309.0]], [[552.0, 281.0], [649.0, 281.0], [649.0, 311.0], [552.0, 311.0]], [[843.0, 281.0], [929.0, 281.0], [929.0, 311.0], [843.0, 311.0]], [[1264.0, 283.0], [1429.0, 283.0], [1429.0, 309.0], [1264.0, 309.0]], [[67.0, 311.0], [87.0, 311.0], [87.0, 335.0], [67.0, 335.0]], [[106.0, 310.0], [316.0, 310.0], [316.0, 336.0], [106.0, 336.0]], [[553.0, 309.0], [647.0, 309.0], [647.0, 337.0], [553.0, 337.0]], [[844.0, 309.0], [929.0, 309.0], [929.0, 337.0], [844.0, 337.0]], [[1264.0, 310.0], [1430.0, 310.0], [1430.0, 337.0], [1264.0, 337.0]], [[68.0, 338.0], [89.0, 338.0], [89.0, 362.0], [68.0, 362.0]], [[106.0, 337.0], [537.0, 337.0], [537.0, 363.0], [106.0, 363.0]], [[551.0, 336.0], [647.0, 336.0], [647.0, 364.0], [551.0, 364.0]], [[843.0, 335.0], [930.0, 335.0], [930.0, 366.0], [843.0, 366.0]], [[1264.0, 337.0], [1430.0, 337.0], [1430.0, 364.0], [1264.0, 364.0]], [[68.0, 365.0], [97.0, 365.0], [97.0, 390.0], [68.0, 390.0]], [[106.0, 364.0], [316.0, 364.0], [316.0, 391.0], [106.0, 391.0]], [[572.0, 363.0], [629.0, 363.0], [629.0, 392.0], [572.0, 392.0]], [[868.0, 364.0], [909.0, 364.0], [909.0, 392.0], [868.0, 392.0]], [[1106.0, 363.0], [1138.0, 363.0], [1138.0, 392.0], [1106.0, 392.0]], [[1264.0, 364.0], [1430.0, 364.0], [1430.0, 391.0], [1264.0, 391.0]], [[68.0, 392.0], [88.0, 392.0], [88.0, 416.0], [68.0, 416.0]], [[106.0, 391.0], [305.0, 391.0], [305.0, 418.0], [106.0, 418.0]], [[573.0, 392.0], [628.0, 392.0], [628.0, 418.0], [573.0, 418.0]], [[868.0, 391.0], [910.0, 391.0], [910.0, 419.0], [868.0, 419.0]], [[1107.0, 392.0], [1137.0, 392.0], [1137.0, 418.0], [1107.0, 418.0]], [[1264.0, 391.0], [1430.0, 391.0], [1430.0, 418.0], [1264.0, 418.0]], [[67.0, 420.0], [87.0, 420.0], [87.0, 443.0], [67.0, 443.0]], [[106.0, 419.0], [328.0, 419.0], [328.0, 444.0], [106.0, 444.0]], [[573.0, 419.0], [628.0, 419.0], [628.0, 444.0], [573.0, 444.0]], [[868.0, 418.0], [910.0, 418.0], [910.0, 445.0], [868.0, 445.0]], [[1106.0, 419.0], [1137.0, 419.0], [1137.0, 444.0], [1106.0, 444.0]], [[1263.0, 417.0], [1430.0, 417.0], [1430.0, 446.0], [1263.0, 446.0]], [[67.0, 446.0], [88.0, 446.0], [88.0, 470.0], [67.0, 470.0]], [[106.0, 445.0], [338.0, 445.0], [338.0, 471.0], [106.0, 471.0]], [[572.0, 444.0], [628.0, 444.0], [628.0, 473.0], [572.0, 473.0]], [[868.0, 445.0], [909.0, 445.0], [909.0, 472.0], [868.0, 472.0]], [[1105.0, 444.0], [1139.0, 444.0], [1139.0, 473.0], [1105.0, 473.0]], [[1264.0, 445.0], [1430.0, 445.0], [1430.0, 472.0], [1264.0, 472.0]], [[69.0, 474.0], [90.0, 474.0], [90.0, 497.0], [69.0, 497.0]], [[105.0, 472.0], [430.0, 472.0], [430.0, 499.0], [105.0, 499.0]], [[573.0, 473.0], [628.0, 473.0], [628.0, 499.0], [573.0, 499.0]], [[868.0, 472.0], [909.0, 472.0], [909.0, 499.0], [868.0, 499.0]], [[1093.0, 471.0], [1150.0, 471.0], [1150.0, 500.0], [1093.0, 500.0]], [[1264.0, 472.0], [1429.0, 472.0], [1429.0, 499.0], [1264.0, 499.0]], [[67.0, 498.0], [316.0, 498.0], [316.0, 528.0], [67.0, 528.0]], [[573.0, 500.0], [628.0, 500.0], [628.0, 526.0], [573.0, 526.0]], [[867.0, 499.0], [909.0, 499.0], [909.0, 527.0], [867.0, 527.0]], [[1104.0, 499.0], [1139.0, 499.0], [1139.0, 527.0], [1104.0, 527.0]], [[1264.0, 499.0], [1430.0, 499.0], [1430.0, 526.0], [1264.0, 526.0]], [[85.0, 902.0], [157.0, 902.0], [157.0, 938.0], [85.0, 938.0]], [[57.0, 941.0], [374.0, 941.0], [374.0, 968.0], [57.0, 968.0]], [[539.0, 941.0], [850.0, 941.0], [850.0, 968.0], [539.0, 968.0]], [[1037.0, 942.0], [1355.0, 942.0], [1355.0, 968.0], [1037.0, 968.0]], [[1034.0, 962.0], [1450.0, 968.0], [1449.0, 1012.0], [1033.0, 1005.0]], [[56.0, 973.0], [420.0, 973.0], [420.0, 1002.0], [56.0, 1002.0]], [[473.0, 973.0], [918.0, 973.0], [918.0, 1002.0], [473.0, 1002.0]], [[56.0, 1008.0], [1022.0, 1008.0], [1022.0, 1036.0], [56.0, 1036.0]], [[57.0, 1035.0], [661.0, 1035.0], [661.0, 1061.0], [57.0, 1061.0]]], "scores": [0.97919, 0.99994, 0.9998, 0.9995, 0.95975, 0.985, 0.9682, 0.98976, 0.90578, 0.99334, 0.98864, 0.95209, 0.97972, 0.97358, 0.99063, 0.98735, 0.98135, 0.99988, 0.99956, 0.99971, 0.99993, 0.99978, 0.99586, 0.94148, 0.99676, 0.98439, 0.99993, 0.99997, 0.99949, 0.99999, 0.99991, 1.0, 0.99424, 0.95212, 0.9797, 0.99992, 0.99999, 0.99718, 0.94247, 0.97663, 0.99993, 0.99999, 0.99671, 0.88972, 0.98857, 0.99993, 0.99932, 0.99922, 0.99999, 0.99952, 0.99964, 0.99995, 0.99997, 0.97964, 0.99314, 0.99955, 0.99907, 0.99995, 0.99999, 0.99255, 0.99999, 0.99949, 0.99966, 0.99995, 0.99876, 0.99953, 1.0, 0.99956, 0.9992, 0.99995, 0.99997, 0.98587, 0.99999, 0.99958, 0.99972, 0.99995, 0.97547, 0.99999, 0.99945, 0.99944, 0.99995, 0.99913, 0.92809, 0.98698, 0.97315, 0.95372, 0.99923, 0.98449, 0.99481, 0.99977], "elapse": 1.6272717509418726, "elapse_list": [0.26851191697642207, 0.05295399995520711, 1.3058058340102434], "engine": "onnxruntime", "model_info": {"det": "PP-OCRv6_small", "cls": "PP-OCRv4_mobile", "rec": "PP-OCRv6_small"}}
