{"txts": ["◆", "◆", "◆", "◆", "◆", "◆", "◆", "◆", "◆", "◆", "◆", "◆", "◆", "◆", "◆", "◆", "缩写", "结果", "单位", "参考区间", "◆", "序号 项目名称", "◆", "25(0H) D", "39.60", "ng/ml", "<12ng/m1缺乏", "1 总25羟基维生素D", "2", "12-20ng/ml不足", "3", "4", ">20ng/ml正常", "5", "◆", "7 铁蛋白测定", "Fer", "8.20", "ng/ml", "4.63~204.00", "◆", "8 叶酸测定", "9 维生素B12测定", "FA", "VitB12", "18.40", "357.00", "pg/mL.", "ng/ml", "3.10~20.50", "187.00~883.00", "◆", "◆", "◆", "◆", "◆", "◆", "◆", "◆", "◆", "◆", "◆", "◆", "◆"], "boxes": [[[1216.0, 26.0], [1487.0, 22.0], [1487.0, 52.0], [1217.0, 56.0]], [[29.0, 55.0], [748.0, 27.0], [750.0, 66.0], [31.0, 94.0]], [[114.0, 81.0], [1283.0, 50.0], [1284.0, 102.0], [115.0, 132.0]], [[645.0, 134.0], [816.0, 132.0], [817.0, 165.0], [645.0, 167.0]], [[1061.0, 131.0], [1200.0, 128.0], [1201.0, 161.0], [1062.0, 164.0]], [[275.0, 149.0], [494.0, 144.0], [494.0, 173.0], [275.0, 179.0]], [[35.0, 159.0], [176.0, 150.0], [178.0, 184.0], [37.0, 193.0]], [[647.0, 169.0], [840.0, 166.0], [841.0, 198.0], [647.0, 202.0]], [[1066.0, 164.0], [1330.0, 159.0], [1331.0, 188.0], [1067.0, 194.0]], [[278.0, 180.0], [463.0, 175.0], [464.0, 208.0], [278.0, 213.0]], [[36.0, 194.0], [134.0, 190.0], [135.0, 225.0], [38.0, 229.0]], [[1068.0, 194.0], [1501.0, 185.0], [1501.0, 215.0], [1069.0, 224.0]], [[36.0, 228.0], [154.0, 222.0], [155.0, 256.0], [38.0, 262.0]], [[277.0, 215.0], [345.0, 215.0], [345.0, 251.0], [277.0, 251.0]], [[646.0, 206.0], [815.0, 202.0], [816.0, 235.0], [646.0, 238.0]], [[1069.0, 221.0], [1193.0, 218.0], [1194.0, 249.0], [1070.0, 251.0]], [[472.0, 265.0], [531.0, 265.0], [531.0, 299.0], [472.0, 299.0]], [[589.0, 258.0], [650.0, 258.0], [650.0, 295.0], [589.0, 295.0]], [[715.0, 257.0], [773.0, 257.0], [773.0, 291.0], [715.0, 291.0]], [[810.0, 257.0], [989.0, 253.0], [989.0, 287.0], [811.0, 291.0]], [[1210.0, 248.0], [1388.0, 244.0], [1388.0, 277.0], [1211.0, 281.0]], [[39.0, 276.0], [207.0, 271.0], [208.0, 304.0], [40.0, 310.0]], [[1174.0, 283.0], [1486.0, 276.0], [1487.0, 306.0], [1174.0, 313.0]], [[474.0, 300.0], [579.0, 298.0], [580.0, 328.0], [475.0, 331.0]], [[595.0, 298.0], [671.0, 296.0], [672.0, 323.0], [596.0, 326.0]], [[707.0, 297.0], [776.0, 297.0], [776.0, 325.0], [707.0, 325.0]], [[820.0, 293.0], [984.0, 290.0], [984.0, 321.0], [821.0, 324.0]], [[39.0, 312.0], [278.0, 304.0], [279.0, 335.0], [40.0, 343.0]], [[46.0, 347.0], [66.0, 347.0], [66.0, 375.0], [46.0, 375.0]], [[821.0, 356.0], [1012.0, 351.0], [1013.0, 385.0], [822.0, 389.0]], [[46.0, 379.0], [66.0, 379.0], [66.0, 407.0], [46.0, 407.0]], [[48.0, 412.0], [67.0, 412.0], [67.0, 439.0], [48.0, 439.0]], [[820.0, 422.0], [987.0, 418.0], [988.0, 451.0], [821.0, 456.0]], [[46.0, 443.0], [69.0, 443.0], [69.0, 472.0], [46.0, 472.0]], [[1175.0, 445.0], [1492.0, 438.0], [1493.0, 470.0], [1176.0, 478.0]], [[44.0, 471.0], [288.0, 464.0], [289.0, 497.0], [45.0, 504.0]], [[474.0, 463.0], [526.0, 463.0], [526.0, 493.0], [474.0, 493.0]], [[597.0, 459.0], [663.0, 456.0], [664.0, 489.0], [598.0, 492.0]], [[708.0, 457.0], [781.0, 454.0], [782.0, 486.0], [709.0, 489.0]], [[821.0, 456.0], [986.0, 452.0], [986.0, 482.0], [822.0, 486.0]], [[1176.0, 479.0], [1491.0, 471.0], [1491.0, 502.0], [1177.0, 509.0]], [[44.0, 503.0], [186.0, 499.0], [187.0, 533.0], [45.0, 536.0]], [[47.0, 536.0], [253.0, 532.0], [253.0, 562.0], [48.0, 566.0]], [[474.0, 495.0], [515.0, 495.0], [515.0, 527.0], [474.0, 527.0]], [[476.0, 527.0], [565.0, 525.0], [566.0, 557.0], [477.0, 559.0]], [[594.0, 493.0], [676.0, 490.0], [677.0, 521.0], [595.0, 523.0]], [[599.0, 523.0], [689.0, 521.0], [690.0, 553.0], [600.0, 555.0]], [[707.0, 523.0], [784.0, 519.0], [785.0, 550.0], [709.0, 554.0]], [[708.0, 490.0], [781.0, 487.0], [782.0, 519.0], [709.0, 521.0]], [[821.0, 489.0], [975.0, 485.0], [976.0, 515.0], [822.0, 518.0]], [[822.0, 520.0], [1014.0, 516.0], [1014.0, 546.0], [823.0, 550.0]], [[1177.0, 511.0], [1492.0, 504.0], [1492.0, 534.0], [1177.0, 541.0]], [[43.0, 863.0], [101.0, 863.0], [101.0, 896.0], [43.0, 896.0]], [[1186.0, 859.0], [1371.0, 845.0], [1379.0, 957.0], [1195.0, 971.0]], [[1124.0, 873.0], [1213.0, 873.0], [1213.0, 907.0], [1124.0, 907.0]], [[44.0, 896.0], [377.0, 887.0], [377.0, 917.0], [45.0, 925.0]], [[614.0, 887.0], [959.0, 878.0], [960.0, 908.0], [615.0, 916.0]], [[1122.0, 908.0], [1215.0, 905.0], [1216.0, 948.0], [1123.0, 950.0]], [[44.0, 926.0], [379.0, 918.0], [380.0, 951.0], [45.0, 959.0]], [[615.0, 920.0], [959.0, 912.0], [960.0, 942.0], [616.0, 950.0]], [[44.0, 955.0], [541.0, 945.0], [542.0, 981.0], [45.0, 991.0]], [[615.0, 947.0], [923.0, 941.0], [924.0, 971.0], [616.0, 977.0]], [[43.0, 983.0], [881.0, 968.0], [881.0, 1002.0], [44.0, 1018.0]], [[52.0, 1010.0], [1129.0, 987.0], [1129.0, 1023.0], [53.0, 1045.0]]], "scores": [0.98611, 0.9614, 0.99866, 0.99951, 0.99994, 0.99937, 0.99948, 0.99968, 0.99988, 0.99356, 0.9908, 0.97264, 0.99978, 0.97, 0.98562, 0.9978, 0.99994, 0.99995, 0.99986, 0.99987, 0.99989, 0.95353, 0.99955, 0.9021, 0.99999, 0.99225, 0.95319, 0.99201, 0.99981, 0.9985, 0.99918, 0.99994, 0.98834, 0.99995, 0.99942, 0.97429, 0.99673, 0.99791, 0.908, 0.99965, 0.9994, 0.9637, 0.96574, 0.99874, 0.99835, 0.99983, 0.99999, 0.86573, 0.93753, 0.99877, 0.99962, 0.9997, 0.99886, 0.55484, 0.99565, 0.97358, 0.97538, 0.9976, 0.99283, 0.97748, 0.99972, 0.99641, 0.9905, 0.98737], "elapse": 1.2204889999702573, "elapse_list": [0.2862663329578936, 0.040029084077104926, 0.8941935829352587], "engine": "onnxruntime", "model_info": {"det": "PP-OCRv6_small", "cls": "PP-OCRv4_mobile", "rec": "PP-OCRv6_small"}}
