{"txts":["超声检查报告单","姓名：","性别：","女","年龄：","检查","科别：","临床科室：","产科门诊","住院号：","11-14周NT筛查(省免)、11-14周NT","床号：","申请医生：邵菊珍","检查设备：","E8(60021)","检查部位：","筛查(自费)、11-14周NT筛查(生育)","检查所见：","经腹扫查：","子宫颈管长约36mm。","增大的子宫腔内可见一胎儿回声。见胎心搏动及胎动，胎心率159次/分，律齐。","胎儿超声测值：胎儿颈项透明层厚度（NT）2.6mm，头臀长59mm，双顶径18mm。","胎盘附着于子宫前壁，厚度：11mm，成熟度0级，羊水最大前后径31mm。","双上肢前臂及上臂切面可见，双下肢大腿及小腿切面可见。脐部未见明确包块向外膨出。","母体双侧附件区未见明显异常回声。","子宫动脉血流频谱：右侧子宫动脉血流：PI 1.58：左侧子宫动脉血流：PI 1.68。","检查提示：","宫内单活胎，胎儿超声测值评估约孕12W+3d大小。","胎儿颈项透明层厚度（NT）2.6mm，建议产前门诊咨询及及进一步检查。","胎儿颈项透明层厚度在正常范围内。","母体子宫动脉血流频谱暂未见明显异常。","注：此次检查主要测量胎儿NT（颈项透明层厚度）、估测胎儿孕周及对胎儿部分结构进行检查，不进","行系统胎儿结构检查，特此告知。建议孕20-24周行II-III级胎儿产前超声检查。"],"boxes":[[[242.0,5.0],[372.0,2.0],[373.0,27.0],[243.0,30.0]],[[23.0,47.0],[66.0,47.0],[66.0,67.0],[23.0,67.0]],[[142.0,44.0],[183.0,44.0],[183.0,65.0],[142.0,65.0]],[[229.0,45.0],[249.0,45.0],[249.0,64.0],[229.0,64.0]],[[324.0,42.0],[366.0,42.0],[366.0,62.0],[324.0,62.0]],[[473.0,41.0],[504.0,41.0],[504.0,60.0],[473.0,60.0]],[[22.0,67.0],[65.0,67.0],[65.0,89.0],[22.0,89.0]],[[142.0,66.0],[212.0,66.0],[212.0,86.0],[142.0,86.0]],[[228.0,65.0],[289.0,63.0],[289.0,84.0],[229.0,86.0]],[[323.0,64.0],[379.0,61.0],[380.0,85.0],[324.0,87.0]],[[405.0,73.0],[604.0,79.0],[604.0,102.0],[404.0,96.0]],[[475.0,59.0],[515.0,61.0],[514.0,83.0],[474.0,80.0]],[[9.0,90.0],[134.0,87.0],[134.0,109.0],[9.0,112.0]],[[142.0,88.0],[212.0,88.0],[212.0,108.0],[142.0,108.0]],[[227.0,89.0],[294.0,87.0],[294.0,107.0],[228.0,109.0]],[[325.0,87.0],[393.0,85.0],[394.0,106.0],[325.0,108.0]],[[404.0,91.0],[609.0,96.0],[609.0,118.0],[403.0,112.0]],[[5.0,286.0],[74.0,284.0],[74.0,305.0],[5.0,307.0]],[[6.0,304.0],[73.0,302.0],[74.0,323.0],[7.0,325.0]],[[8.0,319.0],[133.0,316.0],[133.0,336.0],[9.0,339.0]],[[7.0,333.0],[490.0,323.0],[490.0,345.0],[8.0,355.0]],[[8.0,348.0],[491.0,340.0],[491.0,361.0],[9.0,370.0]],[[10.0,364.0],[443.0,356.0],[443.0,377.0],[10.0,386.0]],[[10.0,380.0],[536.0,371.0],[536.0,391.0],[10.0,400.0]],[[10.0,396.0],[223.0,391.0],[223.0,410.0],[10.0,415.0]],[[12.0,410.0],[511.0,400.0],[512.0,420.0],[12.0,430.0]],[[9.0,461.0],[78.0,461.0],[78.0,483.0],[9.0,483.0]],[[12.0,480.0],[313.0,475.0],[313.0,495.0],[13.0,499.0]],[[13.0,496.0],[438.0,489.0],[438.0,509.0],[14.0,516.0]],[[13.0,511.0],[224.0,509.0],[224.0,528.0],[13.0,530.0]],[[13.0,526.0],[252.0,524.0],[252.0,544.0],[13.0,546.0]],[[13.0,569.0],[619.0,561.0],[619.0,586.0],[14.0,594.0]],[[15.0,585.0],[497.0,583.0],[498.0,605.0],[15.0,606.0]]],"scores":[0.99992,0.99914,0.99908,0.99996,0.99943,0.98856,0.99801,0.99979,0.99998,0.99989,0.99508,0.99967,0.99979,0.99975,0.98843,0.99959,0.98817,0.99969,0.99915,0.99969,0.99979,0.99644,0.99945,0.99984,0.99987,0.98414,0.99959,0.99951,0.99658,0.99986,0.99976,0.99895,0.99715],"elapse":0.8333158330060542,"elapse_list":[0.10935112508013844,0.021147083025425673,0.70281762490049],"engine":"onnxruntime","model_info":{"det":"PP-OCRv6_small","cls":"PP-OCRv4_mobile","rec":"PP-OCRv6_small"}}
