{"txts":["厦门弘爱医院检验报告单","门诊","备注：","410000925174","医嘱名称：","甲功六项","姓名：","性别：男","年龄：29岁","申请单号：410000925174","病历号：","床号：","标本种类：血清","标本说明：合格","科","室：内分泌科门诊","诊断：","编号项目","结果","状态","参考区间","年位","测定方法","1","高敏促甲状腺激素(sTSH)","0.450","0.560~5.910","mIU/L","化学发光法(贝克曼)","23456","游离三碘甲状腺原氨酸(FT3)","5.54","3.80~6.00","pmol/L","化学发光法(贝克曼)","游离甲状腺素(FT4)","12.52","7.86~14.41","pmol/L","化学发光法(贝克曼)","甲状腺过氧化物酶抗体(TPOAb)","0.40","<9.0","IU/mL","化学发光法(贝克曼)","抗甲状腺球蛋白抗体(Tg-Ab)","<0.9","<4.0","1U/mL","化学发光法(贝克曼)","抗促甲状腺素受体抗体(TRAb)","0.31","<1.75","IU/L","电化学发光仪器法(罗日"],"boxes":[[[340.0,85.0],[664.0,86.0],[664.0,121.0],[340.0,119.0]],[[709.0,109.0],[743.0,109.0],[743.0,129.0],[709.0,129.0]],[[98.0,121.0],[138.0,121.0],[138.0,142.0],[98.0,142.0]],[[787.0,132.0],[850.0,132.0],[850.0,144.0],[787.0,144.0]],[[96.0,145.0],[166.0,145.0],[166.0,164.0],[96.0,164.0]],[[187.0,146.0],[251.0,146.0],[251.0,164.0],[187.0,164.0]],[[95.0,173.0],[179.0,173.0],[179.0,197.0],[95.0,197.0]],[[334.0,176.0],[427.0,176.0],[427.0,199.0],[334.0,199.0]],[[502.0,173.0],[616.0,175.0],[616.0,200.0],[501.0,198.0]],[[690.0,179.0],[875.0,179.0],[875.0,197.0],[690.0,197.0]],[[95.0,204.0],[177.0,204.0],[177.0,227.0],[95.0,227.0]],[[334.0,204.0],[400.0,204.0],[400.0,228.0],[334.0,228.0]],[[503.0,204.0],[616.0,204.0],[616.0,225.0],[503.0,225.0]],[[688.0,205.0],[810.0,205.0],[810.0,226.0],[688.0,226.0]],[[92.0,229.0],[157.0,229.0],[157.0,256.0],[92.0,256.0]],[[147.0,231.0],[294.0,231.0],[294.0,254.0],[147.0,254.0]],[[500.0,229.0],[584.0,231.0],[583.0,257.0],[500.0,255.0]],[[112.0,261.0],[236.0,261.0],[236.0,288.0],[112.0,288.0]],[[378.0,264.0],[428.0,264.0],[428.0,286.0],[378.0,286.0]],[[453.0,264.0],[495.0,264.0],[495.0,286.0],[453.0,286.0]],[[532.0,263.0],[606.0,263.0],[606.0,286.0],[532.0,286.0]],[[719.0,267.0],[766.0,267.0],[766.0,287.0],[719.0,287.0]],[[778.0,264.0],[849.0,264.0],[849.0,287.0],[778.0,287.0]],[[128.0,298.0],[139.0,298.0],[139.0,313.0],[128.0,313.0]],[[156.0,295.0],[321.0,295.0],[321.0,314.0],[156.0,314.0]],[[378.0,295.0],[419.0,295.0],[419.0,312.0],[378.0,312.0]],[[525.0,294.0],[617.0,295.0],[617.0,314.0],[524.0,312.0]],[[719.0,294.0],[761.0,294.0],[761.0,313.0],[719.0,313.0]],[[784.0,294.0],[908.0,294.0],[908.0,312.0],[784.0,312.0]],[[125.0,310.0],[141.0,310.0],[141.0,400.0],[125.0,400.0]],[[155.0,312.0],[344.0,312.0],[344.0,331.0],[155.0,331.0]],[[378.0,312.0],[414.0,312.0],[414.0,329.0],[378.0,329.0]],[[525.0,312.0],[601.0,312.0],[601.0,329.0],[525.0,329.0]],[[717.0,311.0],[765.0,311.0],[765.0,330.0],[717.0,330.0]],[[784.0,310.0],[908.0,310.0],[908.0,328.0],[784.0,328.0]],[[154.0,329.0],[284.0,329.0],[284.0,348.0],[154.0,348.0]],[[378.0,329.0],[419.0,329.0],[419.0,346.0],[378.0,346.0]],[[526.0,329.0],[608.0,329.0],[608.0,345.0],[526.0,345.0]],[[718.0,327.0],[766.0,327.0],[766.0,346.0],[718.0,346.0]],[[785.0,327.0],[908.0,327.0],[908.0,344.0],[785.0,344.0]],[[154.0,346.0],[358.0,344.0],[358.0,363.0],[154.0,364.0]],[[378.0,346.0],[413.0,346.0],[413.0,363.0],[378.0,363.0]],[[526.0,344.0],[560.0,344.0],[560.0,362.0],[526.0,362.0]],[[721.0,344.0],[762.0,344.0],[762.0,361.0],[721.0,361.0]],[[784.0,342.0],[908.0,342.0],[908.0,361.0],[784.0,361.0]],[[153.0,363.0],[344.0,362.0],[344.0,381.0],[153.0,381.0]],[[378.0,362.0],[413.0,362.0],[413.0,380.0],[378.0,380.0]],[[526.0,362.0],[560.0,362.0],[560.0,379.0],[526.0,379.0]],[[722.0,360.0],[762.0,360.0],[762.0,377.0],[722.0,377.0]],[[785.0,359.0],[909.0,359.0],[909.0,377.0],[785.0,377.0]],[[153.0,379.0],[352.0,378.0],[353.0,398.0],[153.0,400.0]],[[378.0,379.0],[412.0,379.0],[412.0,397.0],[378.0,397.0]],[[526.0,377.0],[568.0,377.0],[568.0,394.0],[526.0,394.0]],[[726.0,376.0],[760.0,376.0],[760.0,394.0],[726.0,394.0]],[[785.0,375.0],[931.0,375.0],[931.0,393.0],[785.0,393.0]]],"scores":[0.99942,0.99998,0.9964,0.87344,0.99529,0.99963,0.8527,0.99965,0.91707,0.99996,0.99013,0.99801,0.97507,0.99997,0.99998,0.99977,0.99502,0.9997,0.99994,0.99994,0.9999,0.80954,0.99861,0.99533,0.9992,0.99999,0.99963,0.99896,0.99035,0.99808,0.99585,0.99999,0.99996,0.99741,0.99217,0.99847,0.99999,0.99987,0.99837,0.98274,0.99183,0.97717,0.99934,0.99561,0.98284,0.9958,0.99852,0.99975,0.94044,0.97728,0.99487,0.99943,0.99958,0.99138,0.99605],"elapse":0.8691087088081986,"elapse_list":[0.20194504200480878,0.03413083287887275,0.633032833924517],"engine":"onnxruntime","model_info":{"det":"PP-OCRv6_small","cls":"PP-OCRv4_mobile","rec":"PP-OCRv6_small"}}
