{"txts": ["项目名称:铜蓝蛋白", "◆", "◆", "◆", "◆", "◆", "◆", "◆", "◆", "◆", "◆", "◆", "◆", "◆", "◆", "◆", "No 项目名称", "结果", "参考区间", "单位", "◆", "1 铜蓝蛋白(CER)", "0.266", "0.21-0.53", "g/L", "◆", "◆", "◆", "◆", "◆", "◆", "◆", "◆", "◆", "◆"], "boxes": [[[55.0, 16.0], [278.0, 18.0], [278.0, 49.0], [55.0, 47.0]], [[1289.0, 15.0], [1422.0, 15.0], [1422.0, 45.0], [1289.0, 45.0]], [[340.0, 43.0], [1042.0, 43.0], [1042.0, 85.0], [340.0, 85.0]], [[1332.0, 48.0], [1390.0, 48.0], [1390.0, 81.0], [1332.0, 81.0]], [[54.0, 87.0], [191.0, 85.0], [191.0, 122.0], [54.0, 124.0]], [[341.0, 94.0], [572.0, 94.0], [572.0, 121.0], [341.0, 121.0]], [[726.0, 92.0], [985.0, 92.0], [985.0, 122.0], [726.0, 122.0]], [[1087.0, 93.0], [1423.0, 93.0], [1423.0, 122.0], [1087.0, 122.0]], [[55.0, 122.0], [160.0, 122.0], [160.0, 156.0], [55.0, 156.0]], [[338.0, 123.0], [548.0, 123.0], [548.0, 156.0], [338.0, 156.0]], [[727.0, 124.0], [908.0, 124.0], [908.0, 154.0], [727.0, 154.0]], [[1086.0, 123.0], [1294.0, 123.0], [1294.0, 153.0], [1086.0, 153.0]], [[56.0, 157.0], [183.0, 157.0], [183.0, 187.0], [56.0, 187.0]], [[336.0, 156.0], [472.0, 156.0], [472.0, 189.0], [336.0, 189.0]], [[727.0, 158.0], [997.0, 158.0], [997.0, 187.0], [727.0, 187.0]], [[1087.0, 158.0], [1295.0, 158.0], [1295.0, 187.0], [1087.0, 187.0]], [[65.0, 193.0], [205.0, 193.0], [205.0, 223.0], [65.0, 223.0]], [[572.0, 191.0], [630.0, 191.0], [630.0, 224.0], [572.0, 224.0]], [[838.0, 194.0], [937.0, 194.0], [937.0, 222.0], [838.0, 222.0]], [[1094.0, 191.0], [1151.0, 191.0], [1151.0, 225.0], [1094.0, 225.0]], [[1297.0, 192.0], [1398.0, 192.0], [1398.0, 223.0], [1297.0, 223.0]], [[65.0, 229.0], [256.0, 229.0], [256.0, 256.0], [65.0, 256.0]], [[567.0, 229.0], [634.0, 229.0], [634.0, 257.0], [567.0, 257.0]], [[832.0, 229.0], [943.0, 229.0], [943.0, 256.0], [832.0, 256.0]], [[1099.0, 228.0], [1145.0, 228.0], [1145.0, 260.0], [1099.0, 260.0]], [[1286.0, 227.0], [1409.0, 227.0], [1409.0, 258.0], [1286.0, 258.0]], [[85.0, 902.0], [157.0, 902.0], [157.0, 938.0], [85.0, 938.0]], [[57.0, 942.0], [374.0, 942.0], [374.0, 968.0], [57.0, 968.0]], [[539.0, 942.0], [850.0, 942.0], [850.0, 968.0], [539.0, 968.0]], [[1037.0, 942.0], [1354.0, 942.0], [1354.0, 969.0], [1037.0, 969.0]], [[1034.0, 963.0], [1462.0, 968.0], [1462.0, 1015.0], [1033.0, 1009.0]], [[57.0, 973.0], [421.0, 973.0], [421.0, 1002.0], [57.0, 1002.0]], [[473.0, 973.0], [942.0, 973.0], [942.0, 1002.0], [473.0, 1002.0]], [[56.0, 1007.0], [1021.0, 1007.0], [1021.0, 1035.0], [56.0, 1035.0]], [[57.0, 1035.0], [661.0, 1035.0], [661.0, 1061.0], [57.0, 1061.0]]], "scores": [0.96324, 0.99994, 0.99986, 0.99966, 0.94943, 0.9761, 0.98914, 0.98089, 0.92798, 0.9862, 0.98459, 0.99627, 0.99212, 0.95892, 0.96448, 0.96524, 0.98592, 0.9999, 0.9999, 0.99939, 0.99991, 0.96389, 0.99999, 0.99987, 0.99993, 0.99882, 0.99923, 0.98973, 0.98705, 0.96306, 0.87194, 0.99765, 0.98411, 0.99446, 0.99978], "elapse": 0.8745252080261707, "elapse_list": [0.2705920001026243, 0.022174583049491048, 0.5817586248740554], "engine": "onnxruntime", "model_info": {"det": "PP-OCRv6_small", "cls": "PP-OCRv4_mobile", "rec": "PP-OCRv6_small"}}
