{"txts": ["项目名称：凝血六项", "◆", "◆", "◆", "◆", "◆", "◆", "◆", "◆", "◆", "标本种类：枸橼酸钠1:9抗凝血", "◆", "◆", "◆", "◆", "◆", "No 项目名称", "结果", "参考区间", "单位", "◆", "1", "凝血酶原时间测定(PT)", "10.8", "9.8-12.1", "秒", "◆", "2", "凝血酶原时间比值(PTR)", "0.95", "0.82-1.15", "◆", "3", "国际标准化比值(INR)", "0.94", "0.9-1.3", "◆", "4", "凝血酶原活动度(PTA)", "111.5", "75-158", "%", "◆", "5", "活化部分凝血活酶时间测定(APTT)", "23.0", "22.7-31.8", "秒", "◆", "6", "纤维蛋白原(FIB)", "2.71", "1.80-3.50", "g/L", "◆", "7", "凝血酶时间测定(TT)", "18.4", "14-21", "秒", "◆", "8", "D一二聚体(DDN)", "440.00", "0-1000", "ng/mL", "◆", "9", "纤维蛋白（原）降解产物(FDP)", "1.28", "0-5", "μg/mL", "◆", "◆", "◆", "◆", "◆", "◆", "◆", "◆", "◆", "◆", "◆"], "boxes": [[[55.0, 16.0], [279.0, 18.0], [279.0, 48.0], [55.0, 46.0]], [[1289.0, 15.0], [1422.0, 15.0], [1422.0, 45.0], [1289.0, 45.0]], [[341.0, 43.0], [1042.0, 43.0], [1042.0, 85.0], [341.0, 85.0]], [[1332.0, 48.0], [1389.0, 48.0], [1389.0, 81.0], [1332.0, 81.0]], [[54.0, 86.0], [191.0, 84.0], [191.0, 122.0], [54.0, 124.0]], [[341.0, 94.0], [572.0, 94.0], [572.0, 121.0], [341.0, 121.0]], [[726.0, 92.0], [985.0, 92.0], [985.0, 122.0], [726.0, 122.0]], [[1087.0, 93.0], [1424.0, 93.0], [1424.0, 122.0], [1087.0, 122.0]], [[54.0, 121.0], [158.0, 121.0], [158.0, 155.0], [54.0, 155.0]], [[338.0, 123.0], [546.0, 123.0], [546.0, 153.0], [338.0, 153.0]], [[727.0, 124.0], [1077.0, 124.0], [1077.0, 154.0], [727.0, 154.0]], [[1084.0, 124.0], [1295.0, 124.0], [1295.0, 154.0], [1084.0, 154.0]], [[57.0, 157.0], [182.0, 157.0], [182.0, 187.0], [57.0, 187.0]], [[335.0, 154.0], [474.0, 154.0], [474.0, 190.0], [335.0, 190.0]], [[726.0, 157.0], [972.0, 157.0], [972.0, 186.0], [726.0, 186.0]], [[1088.0, 158.0], [1323.0, 158.0], [1323.0, 187.0], [1088.0, 187.0]], [[66.0, 193.0], [204.0, 193.0], [204.0, 223.0], [66.0, 223.0]], [[572.0, 191.0], [629.0, 191.0], [629.0, 224.0], [572.0, 224.0]], [[839.0, 194.0], [937.0, 194.0], [937.0, 222.0], [839.0, 222.0]], [[1094.0, 191.0], [1151.0, 191.0], [1151.0, 224.0], [1094.0, 224.0]], [[1298.0, 192.0], [1398.0, 192.0], [1398.0, 223.0], [1298.0, 223.0]], [[68.0, 231.0], [89.0, 231.0], [89.0, 253.0], [68.0, 253.0]], [[103.0, 229.0], [407.0, 229.0], [407.0, 255.0], [103.0, 255.0]], [[574.0, 230.0], [628.0, 230.0], [628.0, 256.0], [574.0, 256.0]], [[836.0, 229.0], [938.0, 229.0], [938.0, 256.0], [836.0, 256.0]], [[1105.0, 227.0], [1138.0, 227.0], [1138.0, 258.0], [1105.0, 258.0]], [[1308.0, 227.0], [1386.0, 227.0], [1386.0, 258.0], [1308.0, 258.0]], [[67.0, 257.0], [87.0, 257.0], [87.0, 282.0], [67.0, 282.0]], [[106.0, 256.0], [349.0, 256.0], [349.0, 283.0], [106.0, 283.0]], [[574.0, 257.0], [628.0, 257.0], [628.0, 283.0], [574.0, 283.0]], [[833.0, 258.0], [942.0, 258.0], [942.0, 282.0], [833.0, 282.0]], [[1308.0, 254.0], [1386.0, 254.0], [1386.0, 285.0], [1308.0, 285.0]], [[68.0, 285.0], [86.0, 285.0], [86.0, 308.0], [68.0, 308.0]], [[107.0, 282.0], [393.0, 282.0], [393.0, 308.0], [107.0, 308.0]], [[573.0, 284.0], [628.0, 284.0], [628.0, 309.0], [573.0, 309.0]], [[842.0, 284.0], [933.0, 284.0], [933.0, 310.0], [842.0, 310.0]], [[1309.0, 281.0], [1386.0, 281.0], [1386.0, 311.0], [1309.0, 311.0]], [[68.0, 312.0], [85.0, 312.0], [85.0, 334.0], [68.0, 334.0]], [[106.0, 310.0], [327.0, 310.0], [327.0, 336.0], [106.0, 336.0]], [[570.0, 311.0], [634.0, 311.0], [634.0, 336.0], [570.0, 336.0]], [[849.0, 311.0], [925.0, 311.0], [925.0, 336.0], [849.0, 336.0]], [[1110.0, 309.0], [1134.0, 309.0], [1134.0, 338.0], [1110.0, 338.0]], [[1308.0, 307.0], [1386.0, 307.0], [1386.0, 338.0], [1308.0, 338.0]], [[69.0, 339.0], [86.0, 339.0], [86.0, 361.0], [69.0, 361.0]], [[106.0, 337.0], [523.0, 337.0], [523.0, 363.0], [106.0, 363.0]], [[573.0, 338.0], [628.0, 338.0], [628.0, 364.0], [573.0, 364.0]], [[831.0, 337.0], [944.0, 337.0], [944.0, 364.0], [831.0, 364.0]], [[1106.0, 334.0], [1138.0, 334.0], [1138.0, 365.0], [1106.0, 365.0]], [[1308.0, 336.0], [1386.0, 336.0], [1386.0, 364.0], [1308.0, 364.0]], [[68.0, 363.0], [88.0, 365.0], [85.0, 390.0], [65.0, 388.0]], [[106.0, 363.0], [348.0, 363.0], [348.0, 389.0], [106.0, 389.0]], [[573.0, 365.0], [627.0, 365.0], [627.0, 391.0], [573.0, 391.0]], [[833.0, 366.0], [943.0, 366.0], [943.0, 390.0], [833.0, 390.0]], [[1100.0, 363.0], [1144.0, 363.0], [1144.0, 395.0], [1100.0, 395.0]], [[1298.0, 364.0], [1397.0, 364.0], [1397.0, 392.0], [1298.0, 392.0]], [[69.0, 393.0], [87.0, 393.0], [87.0, 417.0], [69.0, 417.0]], [[106.0, 391.0], [383.0, 391.0], [383.0, 418.0], [106.0, 418.0]], [[574.0, 392.0], [629.0, 392.0], [629.0, 418.0], [574.0, 418.0]], [[854.0, 391.0], [920.0, 391.0], [920.0, 419.0], [854.0, 419.0]], [[1103.0, 388.0], [1140.0, 388.0], [1140.0, 420.0], [1103.0, 420.0]], [[1308.0, 389.0], [1387.0, 389.0], [1387.0, 420.0], [1308.0, 420.0]], [[67.0, 420.0], [87.0, 420.0], [87.0, 443.0], [67.0, 443.0]], [[105.0, 419.0], [338.0, 419.0], [338.0, 444.0], [105.0, 444.0]], [[564.0, 420.0], [639.0, 420.0], [639.0, 444.0], [564.0, 444.0]], [[848.0, 418.0], [926.0, 418.0], [926.0, 445.0], [848.0, 445.0]], [[1087.0, 417.0], [1155.0, 417.0], [1155.0, 448.0], [1087.0, 448.0]], [[1286.0, 417.0], [1409.0, 417.0], [1409.0, 446.0], [1286.0, 446.0]], [[69.0, 447.0], [86.0, 447.0], [86.0, 469.0], [69.0, 469.0]], [[105.0, 445.0], [418.0, 445.0], [418.0, 471.0], [105.0, 471.0]], [[572.0, 444.0], [629.0, 444.0], [629.0, 473.0], [572.0, 473.0]], [[865.0, 445.0], [910.0, 445.0], [910.0, 472.0], [865.0, 472.0]], [[1088.0, 445.0], [1160.0, 445.0], [1160.0, 474.0], [1088.0, 474.0]], [[1286.0, 443.0], [1408.0, 443.0], [1408.0, 473.0], [1286.0, 473.0]], [[85.0, 902.0], [157.0, 902.0], [157.0, 938.0], [85.0, 938.0]], [[57.0, 941.0], [374.0, 941.0], [374.0, 968.0], [57.0, 968.0]], [[539.0, 941.0], [850.0, 941.0], [850.0, 968.0], [539.0, 968.0]], [[1037.0, 942.0], [1356.0, 942.0], [1356.0, 968.0], [1037.0, 968.0]], [[56.0, 973.0], [420.0, 973.0], [420.0, 1002.0], [56.0, 1002.0]], [[473.0, 973.0], [942.0, 973.0], [942.0, 1002.0], [473.0, 1002.0]], [[1034.0, 964.0], [1259.0, 968.0], [1258.0, 1016.0], [1033.0, 1011.0]], [[1240.0, 968.0], [1435.0, 971.0], [1434.0, 1004.0], [1239.0, 1000.0]], [[56.0, 1008.0], [1022.0, 1008.0], [1022.0, 1036.0], [56.0, 1036.0]], [[57.0, 1035.0], [661.0, 1035.0], [661.0, 1061.0], [57.0, 1061.0]]], "scores": [0.98752, 0.99993, 0.99987, 0.99951, 0.97594, 0.98075, 0.98264, 0.99448, 0.88853, 0.99271, 0.97363, 0.99928, 0.9622, 0.97408, 0.98641, 0.92217, 0.97716, 0.99988, 0.99973, 0.99964, 0.99991, 0.99968, 0.97856, 0.99999, 0.99984, 0.99918, 0.99998, 0.99995, 0.99941, 0.99999, 0.99991, 0.99998, 0.99999, 0.98162, 0.99999, 0.99982, 0.99998, 0.99999, 0.99949, 0.99998, 0.99997, 0.99975, 0.99998, 0.99999, 0.99501, 1.0, 0.99977, 0.99969, 0.99997, 0.99998, 0.99724, 0.99997, 0.99984, 0.9999, 0.99957, 0.99998, 0.98361, 1.0, 0.9998, 0.99873, 0.99998, 0.99999, 0.9742, 1.0, 0.99969, 0.99976, 0.99697, 0.99876, 0.98375, 0.99997, 0.99785, 0.97172, 0.99749, 0.99918, 0.94588, 0.98732, 0.96297, 0.99933, 0.9828, 0.98672, 0.90994, 0.99528, 0.9998], "elapse": 1.4530135001987219, "elapse_list": [0.27640979108400643, 0.04709820891730487, 1.1295055001974106], "engine": "onnxruntime", "model_info": {"det": "PP-OCRv6_small", "cls": "PP-OCRv4_mobile", "rec": "PP-OCRv6_small"}}
