{"txts":["上海健康医学院附属崇明医院（上海新华医院崇明分院）","样本号：55","检验报告单","代号","项目名称","结果","参考范围","代号","项目名称","结果","参考范围","461","染","MCHC","HGB","HCT","MCV","MCH","PLT","RBC","RDW-SD","MPV","PDW","血红蛋白","红细胞压积","红细胞","红细胞平均体积","红细胞分布宽度","血小板","平均血红蛋白浓眉","血小板分布宽度","平均血红蛋白里","平均血小板体积","4.53","36.1","79.7","327","118","26.0","40.5","126","10.2","12.5","130--175 g/L","4.3--5.8 10^12/L","40--50 %","8210--1","27--34 pg","316--354 g/L","37--50 %","1/6.0 130--31","9.4--13.5 fL","9--17%","LYMPH%","NEUT%","MONO%","EO%","BASO%","NEUT#","LYMPH#","MONO#","EO#","BASO#","CRP","嗜中性细胞比率","淋巴细胞比率","单核细胞比车","嗜酸性粒细胞比率0.2","嗜碱性粒细胞比率0.8","嗜中性细胞数","淋巴细胞数","单核细胞","嗜酸性粒细胞","嗜碱性粒细胞","C反应蛋白","16.3","67.1","15.6","2.82","11.6111.1--3.2 109/L","2.70 10.1--0.6 109/L","0.03","0.14 10--0.06 109/L","38.201<8 mg/L","40--75 %","120--50 %","13--10 %","0.4--8%","0--1%","1.8--6.3 10^9/L","0.02--0.52 10^9/L",":51","PCT","WBC","血小板压积","白细胞","0.1","17.3","13.5--9.5 109/L","0.1--0.4 %","SAA","血清淀粉样蛋白A17.05","410",":40","复核员：","赵志佳","沈奕","检验日期：2024/08/19 07:51 报告日期：2024/08/19 08:23 检验员："],"boxes":[[[133.0,78.0],[913.0,70.0],[913.0,110.0],[134.0,118.0]],[[927.0,99.0],[1028.0,97.0],[1028.0,124.0],[927.0,126.0]],[[491.0,110.0],[649.0,106.0],[650.0,141.0],[492.0,145.0]],[[86.0,165.0],[140.0,165.0],[140.0,196.0],[86.0,196.0]],[[199.0,167.0],[294.0,167.0],[294.0,196.0],[199.0,196.0]],[[333.0,169.0],[384.0,166.0],[386.0,194.0],[334.0,197.0]],[[451.0,166.0],[540.0,164.0],[541.0,193.0],[452.0,195.0]],[[617.0,164.0],[663.0,162.0],[665.0,191.0],[618.0,194.0]],[[715.0,162.0],[802.0,160.0],[803.0,188.0],[716.0,190.0]],[[839.0,160.0],[886.0,160.0],[886.0,185.0],[839.0,185.0]],[[945.0,156.0],[1024.0,154.0],[1025.0,182.0],[945.0,184.0]],[[0.0,217.0],[37.0,217.0],[37.0,243.0],[0.0,243.0]],[[0.0,374.0],[31.0,374.0],[31.0,403.0],[0.0,403.0]],[[61.0,321.0],[122.0,319.0],[123.0,347.0],[62.0,349.0]],[[62.0,222.0],[108.0,222.0],[108.0,247.0],[62.0,247.0]],[[62.0,245.0],[109.0,245.0],[109.0,274.0],[62.0,274.0]],[[62.0,270.0],[110.0,270.0],[110.0,299.0],[62.0,299.0]],[[62.0,296.0],[111.0,296.0],[111.0,324.0],[62.0,324.0]],[[62.0,372.0],[110.0,372.0],[110.0,401.0],[62.0,401.0]],[[63.0,196.0],[108.0,196.0],[108.0,222.0],[63.0,222.0]],[[63.0,348.0],[148.0,345.0],[148.0,373.0],[64.0,375.0]],[[63.0,397.0],[111.0,397.0],[111.0,425.0],[63.0,425.0]],[[63.0,423.0],[112.0,423.0],[112.0,452.0],[63.0,452.0]],[[162.0,220.0],[252.0,218.0],[253.0,248.0],[163.0,250.0]],[[162.0,245.0],[273.0,242.0],[273.0,271.0],[163.0,274.0]],[[163.0,196.0],[233.0,196.0],[233.0,223.0],[163.0,223.0]],[[163.0,269.0],[315.0,266.0],[316.0,295.0],[164.0,297.0]],[[164.0,344.0],[319.0,340.0],[319.0,368.0],[165.0,372.0]],[[165.0,368.0],[237.0,366.0],[238.0,396.0],[166.0,399.0]],[[166.0,319.0],[333.0,316.0],[334.0,344.0],[166.0,348.0]],[[166.0,419.0],[322.0,413.0],[323.0,445.0],[167.0,450.0]],[[167.0,294.0],[316.0,291.0],[317.0,319.0],[167.0,322.0]],[[167.0,393.0],[320.0,390.0],[321.0,418.0],[167.0,422.0]],[[326.0,198.0],[379.0,198.0],[379.0,222.0],[326.0,222.0]],[[327.0,246.0],[380.0,243.0],[381.0,269.0],[328.0,271.0]],[[327.0,269.0],[383.0,266.0],[384.0,293.0],[328.0,296.0]],[[327.0,318.0],[372.0,318.0],[372.0,343.0],[327.0,343.0]],[[328.0,222.0],[371.0,222.0],[371.0,247.0],[328.0,247.0]],[[329.0,293.0],[385.0,293.0],[385.0,320.0],[329.0,320.0]],[[330.0,342.0],[387.0,339.0],[388.0,367.0],[331.0,370.0]],[[334.0,366.0],[377.0,366.0],[377.0,392.0],[334.0,392.0]],[[334.0,390.0],[390.0,390.0],[390.0,418.0],[334.0,418.0]],[[335.0,414.0],[391.0,414.0],[391.0,442.0],[335.0,442.0]],[[395.0,220.0],[539.0,217.0],[539.0,243.0],[396.0,246.0]],[[396.0,196.0],[581.0,193.0],[581.0,218.0],[397.0,222.0]],[[397.0,245.0],[497.0,243.0],[497.0,267.0],[397.0,268.0]],[[397.0,268.0],[519.0,265.0],[520.0,291.0],[398.0,294.0]],[[400.0,292.0],[509.0,292.0],[509.0,318.0],[400.0,318.0]],[[401.0,316.0],[544.0,313.0],[545.0,339.0],[402.0,342.0]],[[402.0,340.0],[503.0,337.0],[504.0,363.0],[403.0,366.0]],[[405.0,363.0],[580.0,357.0],[581.0,385.0],[405.0,391.0]],[[405.0,388.0],[548.0,384.0],[549.0,410.0],[405.0,415.0]],[[406.0,412.0],[495.0,410.0],[496.0,436.0],[406.0,438.0]],[[596.0,215.0],[671.0,213.0],[672.0,239.0],[597.0,241.0]],[[597.0,192.0],[659.0,192.0],[659.0,217.0],[597.0,217.0]],[[598.0,238.0],[663.0,236.0],[664.0,263.0],[599.0,265.0]],[[600.0,263.0],[643.0,260.0],[644.0,287.0],[601.0,289.0]],[[601.0,286.0],[665.0,283.0],[666.0,311.0],[602.0,313.0]],[[602.0,310.0],[667.0,306.0],[668.0,333.0],[604.0,337.0]],[[604.0,333.0],[679.0,330.0],[680.0,357.0],[605.0,360.0]],[[606.0,357.0],[671.0,354.0],[672.0,381.0],[607.0,384.0]],[[609.0,380.0],[651.0,380.0],[651.0,407.0],[609.0,407.0]],[[609.0,404.0],[674.0,401.0],[675.0,429.0],[610.0,432.0]],[[612.0,427.0],[655.0,427.0],[655.0,456.0],[612.0,456.0]],[[684.0,189.0],[818.0,185.0],[819.0,211.0],[684.0,215.0]],[[686.0,212.0],[803.0,208.0],[804.0,236.0],[687.0,240.0]],[[687.0,235.0],[804.0,232.0],[805.0,258.0],[688.0,261.0]],[[690.0,258.0],[879.0,254.0],[879.0,280.0],[690.0,285.0]],[[690.0,280.0],[880.0,276.0],[881.0,304.0],[690.0,308.0]],[[691.0,304.0],[812.0,300.0],[813.0,329.0],[692.0,333.0]],[[694.0,328.0],[795.0,325.0],[796.0,354.0],[695.0,357.0]],[[695.0,351.0],[781.0,348.0],[782.0,378.0],[696.0,381.0]],[[698.0,375.0],[820.0,372.0],[820.0,400.0],[699.0,403.0]],[[700.0,398.0],[821.0,395.0],[822.0,424.0],[701.0,427.0]],[[701.0,422.0],[793.0,418.0],[795.0,448.0],[703.0,452.0]],[[831.0,186.0],[886.0,186.0],[886.0,211.0],[831.0,211.0]],[[833.0,208.0],[885.0,206.0],[886.0,232.0],[834.0,234.0]],[[835.0,232.0],[887.0,232.0],[887.0,256.0],[835.0,256.0]],[[840.0,302.0],[892.0,299.0],[893.0,325.0],[841.0,327.0]],[[844.0,325.0],[1067.0,316.0],[1068.0,342.0],[845.0,350.0]],[[845.0,348.0],[1069.0,340.0],[1070.0,366.0],[846.0,373.0]],[[848.0,371.0],[900.0,369.0],[901.0,395.0],[849.0,397.0]],[[849.0,394.0],[1065.0,386.0],[1066.0,412.0],[850.0,420.0]],[[852.0,417.0],[997.0,412.0],[998.0,439.0],[853.0,444.0]],[[885.0,184.0],[987.0,182.0],[987.0,207.0],[885.0,209.0]],[[886.0,207.0],[988.0,204.0],[989.0,230.0],[886.0,232.0]],[[887.0,229.0],[982.0,227.0],[983.0,253.0],[887.0,255.0]],[[900.0,253.0],[993.0,250.0],[994.0,274.0],[901.0,277.0]],[[904.0,276.0],[976.0,274.0],[977.0,298.0],[904.0,300.0]],[[906.0,299.0],[1064.0,294.0],[1065.0,319.0],[907.0,325.0]],[[912.0,368.0],[1088.0,362.0],[1089.0,388.0],[913.0,393.0]],[[0.0,440.0],[46.0,440.0],[46.0,468.0],[0.0,468.0]],[[62.0,450.0],[110.0,447.0],[112.0,476.0],[64.0,478.0]],[[63.0,476.0],[111.0,476.0],[111.0,505.0],[63.0,505.0]],[[166.0,444.0],[280.0,440.0],[281.0,472.0],[167.0,476.0]],[[167.0,471.0],[240.0,468.0],[241.0,498.0],[168.0,501.0]],[[333.0,440.0],[378.0,438.0],[380.0,466.0],[334.0,468.0]],[[336.0,465.0],[392.0,462.0],[394.0,490.0],[338.0,493.0]],[[397.0,461.0],[587.0,455.0],[588.0,483.0],[398.0,489.0]],[[406.0,438.0],[530.0,434.0],[531.0,460.0],[407.0,464.0]],[[612.0,453.0],[657.0,450.0],[659.0,479.0],[613.0,482.0]],[[702.0,446.0],[929.0,437.0],[930.0,467.0],[704.0,477.0]],[[921.0,439.0],[970.0,439.0],[970.0,464.0],[921.0,464.0]],[[0.0,503.0],[50.0,501.0],[51.0,529.0],[0.0,531.0]],[[951.0,514.0],[1029.0,511.0],[1030.0,541.0],[953.0,544.0]],[[1046.0,509.0],[1107.0,507.0],[1108.0,537.0],[1047.0,540.0]],[[42.0,564.0],[101.0,564.0],[101.0,594.0],[42.0,594.0]],[[134.0,561.0],[903.0,512.0],[905.0,548.0],[136.0,597.0]]],"scores":[0.99896,0.99818,0.99997,0.99987,0.9985,0.99988,0.99981,0.99912,0.99959,0.99988,0.99949,0.99937,0.74089,0.99972,0.9973,0.99986,0.99824,0.99985,0.99994,0.97356,0.99883,0.98842,0.99935,0.99953,0.99597,0.98221,0.99628,0.99802,0.99028,0.92746,0.99983,0.98577,0.99966,0.99997,0.99998,0.99996,0.99998,0.99997,0.99999,0.99999,0.99998,0.99998,0.99999,0.99786,0.98376,0.94716,0.80143,0.99688,0.99454,0.98036,0.64849,0.97144,0.99297,0.97372,0.97488,0.91171,0.82978,0.99443,0.99967,0.99981,0.99669,0.99271,0.99953,0.99979,0.93332,0.95549,0.90306,0.95568,0.96796,0.98368,0.96218,0.99967,0.99684,0.9836,0.96506,0.99998,0.99992,0.99895,0.99998,0.97317,0.96769,0.99991,0.9713,0.9916,0.97034,0.95269,0.94912,0.99785,0.99246,0.97792,0.97201,0.98909,0.99834,0.9808,0.99758,0.98602,0.99979,0.99998,0.99106,0.96754,0.99842,0.98076,0.75817,0.98911,0.98791,0.99962,0.9986,0.97271],"elapse":1.8500845422968268,"elapse_list":[0.22280633402988315,0.07555662514641881,1.5517215831205249],"engine":"onnxruntime","model_info":{"det":"PP-OCRv6_small","cls":"PP-OCRv4_mobile","rec":"PP-OCRv6_small"}}
