{"txts": ["◆", "◆", "◆", "◆", "◆", "◆", "◆", "◆", "◆", "◆", "◆", "◆", "◆", "◆", "◆", "FT4", "3 游离甲状腺素测定(9-HR)", "◆", "◆", "◆", "◆", "FT3", "◆", "◆", "◆", "◆", "◆", "TSH", "1 促甲状腺激素测定(9-HR)", "◆", "参考区间", "单位", "结果", "缩写", "序号 项目名称", "◆", "患者类别：门诊", "◆", "◆", "◆", "◆", "◆", "◆", "◆", "样本种类：血液", "◆", "◆", "◆", "◆", "项目名称：甲功三项"], "boxes": [[[364.0, 24.0], [1455.0, 28.0], [1455.0, 68.0], [364.0, 63.0]], [[573.0, 86.0], [881.0, 86.0], [881.0, 113.0], [573.0, 113.0]], [[960.0, 83.0], [1459.0, 89.0], [1459.0, 119.0], [959.0, 113.0]], [[243.0, 105.0], [283.0, 105.0], [283.0, 148.0], [243.0, 148.0]], [[287.0, 107.0], [372.0, 107.0], [372.0, 142.0], [287.0, 142.0]], [[537.0, 113.0], [882.0, 113.0], [882.0, 142.0], [537.0, 142.0]], [[1122.0, 118.0], [1460.0, 121.0], [1460.0, 151.0], [1122.0, 148.0]], [[287.0, 149.0], [375.0, 149.0], [375.0, 184.0], [287.0, 184.0]], [[537.0, 147.0], [882.0, 147.0], [882.0, 177.0], [537.0, 177.0]], [[1124.0, 150.0], [1460.0, 153.0], [1460.0, 183.0], [1124.0, 180.0]], [[1402.0, 183.0], [1464.0, 183.0], [1464.0, 216.0], [1402.0, 216.0]], [[0.0, 678.0], [252.0, 678.0], [252.0, 708.0], [0.0, 708.0]], [[520.0, 675.0], [672.0, 677.0], [671.0, 708.0], [520.0, 706.0]], [[694.0, 679.0], [782.0, 679.0], [782.0, 711.0], [694.0, 711.0]], [[819.0, 681.0], [893.0, 681.0], [893.0, 713.0], [819.0, 713.0]], [[966.0, 681.0], [1018.0, 681.0], [1018.0, 712.0], [966.0, 712.0]], [[1128.0, 681.0], [1450.0, 681.0], [1450.0, 711.0], [1128.0, 711.0]], [[0.0, 707.0], [253.0, 709.0], [253.0, 742.0], [0.0, 739.0]], [[536.0, 710.0], [673.0, 710.0], [673.0, 741.0], [536.0, 741.0]], [[691.0, 710.0], [782.0, 707.0], [783.0, 742.0], [692.0, 745.0]], [[829.0, 714.0], [894.0, 714.0], [894.0, 745.0], [829.0, 745.0]], [[967.0, 715.0], [1018.0, 715.0], [1018.0, 743.0], [967.0, 743.0]], [[1047.0, 714.0], [1450.0, 714.0], [1450.0, 743.0], [1047.0, 743.0]], [[0.0, 738.0], [254.0, 741.0], [254.0, 773.0], [0.0, 771.0]], [[508.0, 742.0], [674.0, 742.0], [674.0, 774.0], [508.0, 774.0]], [[685.0, 744.0], [779.0, 744.0], [779.0, 775.0], [685.0, 775.0]], [[818.0, 747.0], [893.0, 747.0], [893.0, 775.0], [818.0, 775.0]], [[965.0, 746.0], [1017.0, 746.0], [1017.0, 776.0], [965.0, 776.0]], [[1127.0, 745.0], [1452.0, 745.0], [1452.0, 775.0], [1127.0, 775.0]], [[75.0, 772.0], [252.0, 772.0], [252.0, 805.0], [75.0, 805.0]], [[504.0, 772.0], [680.0, 777.0], [679.0, 810.0], [503.0, 806.0]], [[718.0, 778.0], [774.0, 778.0], [774.0, 813.0], [718.0, 813.0]], [[842.0, 780.0], [900.0, 780.0], [900.0, 814.0], [842.0, 814.0]], [[960.0, 779.0], [1018.0, 779.0], [1018.0, 813.0], [960.0, 813.0]], [[1283.0, 779.0], [1453.0, 779.0], [1453.0, 812.0], [1283.0, 812.0]], [[24.0, 832.0], [429.0, 832.0], [429.0, 862.0], [24.0, 862.0]], [[674.0, 831.0], [843.0, 833.0], [842.0, 867.0], [673.0, 864.0]], [[1146.0, 832.0], [1210.0, 832.0], [1210.0, 866.0], [1146.0, 866.0]], [[1336.0, 829.0], [1455.0, 829.0], [1455.0, 860.0], [1336.0, 860.0]], [[172.0, 862.0], [430.0, 862.0], [430.0, 891.0], [172.0, 891.0]], [[650.0, 866.0], [844.0, 869.0], [843.0, 901.0], [649.0, 899.0]], [[857.0, 871.0], [1208.0, 871.0], [1208.0, 900.0], [857.0, 900.0]], [[1355.0, 862.0], [1453.0, 862.0], [1453.0, 892.0], [1355.0, 892.0]], [[297.0, 888.0], [434.0, 891.0], [433.0, 924.0], [297.0, 922.0]], [[673.0, 900.0], [843.0, 904.0], [842.0, 937.0], [672.0, 934.0]], [[994.0, 904.0], [1211.0, 904.0], [1211.0, 931.0], [994.0, 931.0]], [[1308.0, 897.0], [1454.0, 897.0], [1454.0, 931.0], [1308.0, 931.0]], [[212.0, 941.0], [1372.0, 948.0], [1372.0, 1008.0], [212.0, 1000.0]], [[12.0, 992.0], [281.0, 992.0], [281.0, 1021.0], [12.0, 1021.0]], [[1244.0, 998.0], [1454.0, 996.0], [1454.0, 1025.0], [1244.0, 1027.0]]], "scores": [0.9953, 0.9943, 0.99995, 0.87196, 0.99833, 0.98254, 0.99248, 0.99667, 0.99792, 0.95914, 0.98952, 0.99949, 0.999, 0.99983, 0.99997, 0.9999, 0.97651, 0.99959, 0.99963, 0.99879, 0.99984, 0.99988, 0.99269, 0.99948, 0.99899, 0.66263, 0.99998, 0.99995, 0.99121, 0.99988, 0.99986, 0.99964, 0.99992, 0.99972, 0.9658, 0.98899, 0.99986, 0.99613, 0.9997, 0.99979, 0.9999, 0.99451, 0.99928, 0.99991, 0.99969, 0.99372, 0.99957, 0.99859, 0.99332, 0.99945], "elapse": 1.0796761251986027, "elapse_list": [0.2674299171194434, 0.030504249967634678, 0.7817419581115246], "engine": "onnxruntime", "model_info": {"det": "PP-OCRv6_small", "cls": "PP-OCRv4_mobile", "rec": "PP-OCRv6_small"}}
