{"txts": ["◆", "项目名称：尿液分析", "◆", "◆", "◆", "样本种类：尿液", "◆", "◆", "◆", "◆", "◆", "◆", "◆", "◆", "◆", "◆", "序号 项目名称", "缩写", "结果", "单位", "参考区间", "◆", "1 尿液颜色", "COLOR", "黄色", "◆", "2 尿液浊度", "CLA", "清亮", "◆", "◆", "3 白细胞酯酶(9-HR)", "WBCC", "◆", "4 亚硝酸盐(9-HR)", "NIT", "5 尿胆原(9-HR)", "UBG", "Normal", "Normal", "◆", "◆", "6蛋白质（9-HR）", "PRO", "7 PH(9-HR)", "PH", "8.00 ↑", "5.50~7.00", "◆", "◆", "8 潜血（或）红细胞(9-HR)", "ERY", "9 比重(9-HR)", "SG", "1.0100", "1.0100~1.0250", "◆", "◆", "10 酮体(9-HR)", "KET", "◆", "11 胆红素(9-HR)", "BIL", "◆", "12 葡萄糖(9-HR)", "GLU", "◆", "13维生素C", "VC", "14 镜检红细胞", "JJHXB", "0.00", "个/HP", "0-2", "◆", "16 镜检结晶", "15 镜检白细胞", "17 镜检管型", "JJBXB", "JJJJ", "JJGX", "0.00", "0.00", "阴性", "个/HIP", "个/LP", "0.00~5.00", "阴性", "透明管型0-1", "◆", "◆", "◆", "18镜检上皮细胞", "JJSPXB", "0.00", "个/LP", "0.00~5.00", "◆", "◆", "◆", "◆", "◆", "◆", "◆", "◆", "◆", "◆", "◆", "◆", "◆"], "boxes": [[[1015.0, 43.0], [1332.0, 41.0], [1332.0, 70.0], [1016.0, 73.0]], [[31.0, 61.0], [240.0, 51.0], [242.0, 85.0], [32.0, 95.0]], [[114.0, 84.0], [1284.0, 66.0], [1285.0, 119.0], [115.0, 136.0]], [[35.0, 161.0], [177.0, 154.0], [179.0, 188.0], [37.0, 195.0]], [[277.0, 154.0], [497.0, 151.0], [498.0, 181.0], [278.0, 184.0]], [[649.0, 143.0], [818.0, 141.0], [819.0, 174.0], [649.0, 176.0]], [[1067.0, 145.0], [1188.0, 145.0], [1188.0, 176.0], [1067.0, 176.0]], [[280.0, 186.0], [465.0, 181.0], [466.0, 215.0], [281.0, 220.0]], [[652.0, 179.0], [842.0, 178.0], [842.0, 208.0], [652.0, 210.0]], [[1069.0, 176.0], [1329.0, 174.0], [1329.0, 203.0], [1069.0, 206.0]], [[37.0, 198.0], [134.0, 194.0], [136.0, 228.0], [38.0, 232.0]], [[280.0, 221.0], [347.0, 221.0], [347.0, 257.0], [280.0, 257.0]], [[652.0, 214.0], [817.0, 213.0], [818.0, 244.0], [652.0, 245.0]], [[1070.0, 207.0], [1496.0, 201.0], [1496.0, 231.0], [1070.0, 236.0]], [[37.0, 231.0], [155.0, 227.0], [156.0, 261.0], [38.0, 264.0]], [[1072.0, 233.0], [1194.0, 233.0], [1194.0, 263.0], [1072.0, 263.0]], [[39.0, 280.0], [208.0, 277.0], [209.0, 311.0], [40.0, 314.0]], [[424.0, 274.0], [482.0, 274.0], [482.0, 307.0], [424.0, 307.0]], [[606.0, 269.0], [664.0, 269.0], [664.0, 302.0], [606.0, 302.0]], [[738.0, 269.0], [793.0, 269.0], [793.0, 299.0], [738.0, 299.0]], [[844.0, 267.0], [1022.0, 265.0], [1023.0, 299.0], [844.0, 301.0]], [[1124.0, 264.0], [1301.0, 262.0], [1301.0, 295.0], [1125.0, 297.0]], [[39.0, 316.0], [184.0, 314.0], [185.0, 347.0], [40.0, 350.0]], [[428.0, 312.0], [501.0, 312.0], [501.0, 340.0], [428.0, 340.0]], [[609.0, 305.0], [668.0, 305.0], [668.0, 338.0], [609.0, 338.0]], [[1128.0, 298.0], [1259.0, 298.0], [1259.0, 329.0], [1128.0, 329.0]], [[42.0, 346.0], [185.0, 341.0], [186.0, 375.0], [43.0, 380.0]], [[427.0, 340.0], [476.0, 340.0], [476.0, 370.0], [427.0, 370.0]], [[608.0, 333.0], [670.0, 333.0], [670.0, 369.0], [608.0, 369.0]], [[1125.0, 326.0], [1260.0, 323.0], [1261.0, 357.0], [1126.0, 360.0]], [[1125.0, 354.0], [1337.0, 352.0], [1337.0, 385.0], [1126.0, 387.0]], [[42.0, 374.0], [287.0, 370.0], [288.0, 403.0], [43.0, 407.0]], [[427.0, 370.0], [488.0, 367.0], [489.0, 397.0], [428.0, 399.0]], [[1126.0, 384.0], [1311.0, 382.0], [1311.0, 413.0], [1127.0, 415.0]], [[42.0, 403.0], [263.0, 399.0], [264.0, 432.0], [43.0, 436.0]], [[427.0, 398.0], [476.0, 398.0], [476.0, 429.0], [427.0, 429.0]], [[42.0, 432.0], [236.0, 428.0], [236.0, 461.0], [43.0, 466.0]], [[427.0, 428.0], [475.0, 428.0], [475.0, 458.0], [427.0, 458.0]], [[608.0, 422.0], [693.0, 422.0], [693.0, 454.0], [608.0, 454.0]], [[835.0, 422.0], [923.0, 420.0], [924.0, 451.0], [836.0, 454.0]], [[1125.0, 413.0], [1259.0, 411.0], [1260.0, 444.0], [1126.0, 446.0]], [[1122.0, 442.0], [1411.0, 437.0], [1411.0, 469.0], [1123.0, 475.0]], [[43.0, 461.0], [255.0, 456.0], [256.0, 490.0], [44.0, 495.0]], [[425.0, 458.0], [475.0, 455.0], [477.0, 486.0], [427.0, 489.0]], [[44.0, 491.0], [182.0, 488.0], [183.0, 519.0], [45.0, 521.0]], [[427.0, 486.0], [465.0, 486.0], [465.0, 515.0], [427.0, 515.0]], [[607.0, 481.0], [699.0, 478.0], [700.0, 510.0], [608.0, 512.0]], [[838.0, 480.0], [976.0, 477.0], [976.0, 507.0], [838.0, 509.0]], [[1122.0, 472.0], [1261.0, 468.0], [1262.0, 502.0], [1123.0, 506.0]], [[1123.0, 499.0], [1359.0, 496.0], [1360.0, 529.0], [1124.0, 532.0]], [[43.0, 518.0], [368.0, 512.0], [369.0, 545.0], [44.0, 551.0]], [[427.0, 515.0], [475.0, 515.0], [475.0, 545.0], [427.0, 545.0]], [[46.0, 548.0], [211.0, 546.0], [211.0, 577.0], [47.0, 579.0]], [[428.0, 544.0], [463.0, 544.0], [463.0, 574.0], [428.0, 574.0]], [[608.0, 540.0], [695.0, 538.0], [696.0, 570.0], [609.0, 572.0]], [[838.0, 538.0], [1026.0, 535.0], [1027.0, 565.0], [838.0, 568.0]], [[1124.0, 530.0], [1284.0, 528.0], [1284.0, 558.0], [1125.0, 560.0]], [[1122.0, 558.0], [1335.0, 554.0], [1336.0, 586.0], [1123.0, 591.0]], [[47.0, 576.0], [212.0, 574.0], [212.0, 606.0], [48.0, 609.0]], [[428.0, 573.0], [476.0, 573.0], [476.0, 604.0], [428.0, 604.0]], [[1122.0, 587.0], [1258.0, 584.0], [1259.0, 617.0], [1123.0, 620.0]], [[49.0, 606.0], [237.0, 603.0], [237.0, 634.0], [50.0, 636.0]], [[428.0, 603.0], [476.0, 603.0], [476.0, 632.0], [428.0, 632.0]], [[1122.0, 617.0], [1311.0, 614.0], [1311.0, 644.0], [1123.0, 646.0]], [[50.0, 634.0], [237.0, 631.0], [237.0, 662.0], [51.0, 665.0]], [[428.0, 630.0], [476.0, 630.0], [476.0, 660.0], [428.0, 660.0]], [[1120.0, 644.0], [1333.0, 642.0], [1333.0, 673.0], [1121.0, 675.0]], [[51.0, 662.0], [181.0, 662.0], [181.0, 693.0], [51.0, 693.0]], [[429.0, 659.0], [465.0, 659.0], [465.0, 689.0], [429.0, 689.0]], [[49.0, 690.0], [215.0, 688.0], [215.0, 721.0], [50.0, 723.0]], [[429.0, 688.0], [503.0, 686.0], [504.0, 717.0], [430.0, 720.0]], [[609.0, 684.0], [668.0, 684.0], [668.0, 714.0], [609.0, 714.0]], [[740.0, 678.0], [812.0, 678.0], [812.0, 710.0], [740.0, 710.0]], [[838.0, 683.0], [884.0, 683.0], [884.0, 710.0], [838.0, 710.0]], [[1121.0, 672.0], [1256.0, 670.0], [1257.0, 703.0], [1122.0, 705.0]], [[50.0, 748.0], [190.0, 744.0], [191.0, 778.0], [51.0, 781.0]], [[51.0, 720.0], [215.0, 718.0], [215.0, 748.0], [52.0, 751.0]], [[51.0, 774.0], [190.0, 772.0], [191.0, 806.0], [52.0, 808.0]], [[429.0, 716.0], [503.0, 713.0], [504.0, 746.0], [430.0, 749.0]], [[429.0, 744.0], [490.0, 741.0], [492.0, 775.0], [430.0, 778.0]], [[430.0, 771.0], [493.0, 771.0], [493.0, 804.0], [430.0, 804.0]], [[607.0, 713.0], [668.0, 710.0], [670.0, 740.0], [609.0, 743.0]], [[609.0, 769.0], [669.0, 769.0], [669.0, 798.0], [609.0, 798.0]], [[610.0, 739.0], [668.0, 739.0], [668.0, 771.0], [610.0, 771.0]], [[740.0, 708.0], [812.0, 708.0], [812.0, 740.0], [740.0, 740.0]], [[740.0, 763.0], [812.0, 763.0], [812.0, 795.0], [740.0, 795.0]], [[838.0, 708.0], [974.0, 708.0], [974.0, 738.0], [838.0, 738.0]], [[838.0, 736.0], [897.0, 736.0], [897.0, 768.0], [838.0, 768.0]], [[839.0, 764.0], [983.0, 764.0], [983.0, 795.0], [839.0, 795.0]], [[1120.0, 700.0], [1254.0, 698.0], [1255.0, 731.0], [1121.0, 734.0]], [[1120.0, 757.0], [1253.0, 754.0], [1254.0, 788.0], [1121.0, 790.0]], [[1121.0, 729.0], [1253.0, 726.0], [1254.0, 759.0], [1122.0, 762.0]], [[53.0, 804.0], [241.0, 802.0], [241.0, 833.0], [54.0, 835.0]], [[430.0, 800.0], [517.0, 798.0], [518.0, 830.0], [431.0, 832.0]], [[607.0, 797.0], [667.0, 795.0], [669.0, 825.0], [609.0, 827.0]], [[738.0, 792.0], [813.0, 790.0], [814.0, 822.0], [740.0, 824.0]], [[836.0, 795.0], [974.0, 793.0], [974.0, 823.0], [836.0, 825.0]], [[1119.0, 785.0], [1252.0, 783.0], [1253.0, 817.0], [1120.0, 819.0]], [[40.0, 842.0], [99.0, 842.0], [99.0, 875.0], [40.0, 875.0]], [[44.0, 891.0], [373.0, 887.0], [374.0, 917.0], [45.0, 921.0]], [[609.0, 887.0], [950.0, 881.0], [951.0, 911.0], [610.0, 916.0]], [[1112.0, 877.0], [1196.0, 877.0], [1196.0, 908.0], [1112.0, 908.0]], [[43.0, 922.0], [375.0, 916.0], [376.0, 949.0], [44.0, 955.0]], [[609.0, 919.0], [949.0, 914.0], [950.0, 944.0], [610.0, 949.0]], [[1110.0, 911.0], [1198.0, 907.0], [1200.0, 947.0], [1112.0, 950.0]], [[43.0, 953.0], [536.0, 943.0], [537.0, 979.0], [44.0, 989.0]], [[609.0, 946.0], [914.0, 942.0], [915.0, 972.0], [610.0, 976.0]], [[1334.0, 971.0], [1454.0, 971.0], [1454.0, 1002.0], [1334.0, 1002.0]], [[42.0, 982.0], [873.0, 968.0], [873.0, 1006.0], [43.0, 1021.0]], [[48.0, 1011.0], [1115.0, 992.0], [1115.0, 1027.0], [49.0, 1045.0]]], "scores": [0.99383, 0.99971, 0.99831, 0.99948, 0.99951, 0.99881, 0.99992, 0.99717, 0.99232, 0.99995, 0.99767, 0.86885, 0.99743, 0.97571, 0.99968, 0.98835, 0.97059, 0.99986, 0.9999, 0.9999, 0.99983, 0.99982, 0.98696, 0.99979, 0.99921, 0.99979, 0.96937, 0.99977, 0.99996, 0.99995, 0.99996, 0.98633, 0.99994, 0.99977, 0.94832, 0.99994, 0.98722, 0.99977, 0.99995, 0.99994, 0.99982, 0.99955, 0.99565, 0.99034, 0.9944, 0.9999, 0.96365, 0.99875, 0.99959, 0.99978, 0.93382, 0.99972, 0.96332, 0.99985, 0.99976, 0.99927, 0.99998, 0.99951, 0.95435, 0.99977, 0.99993, 0.98498, 0.99993, 0.99825, 0.97552, 0.99837, 0.97909, 0.99951, 0.9948, 0.99164, 0.99996, 0.99529, 0.99844, 0.99484, 0.99956, 0.96828, 0.97873, 0.96837, 0.99993, 0.9998, 0.99996, 0.99841, 0.99972, 0.9997, 0.83654, 0.99777, 0.99713, 0.99972, 0.99974, 0.99943, 0.9996, 0.99889, 0.99909, 0.99993, 0.99971, 0.99971, 0.99941, 0.9997, 0.99053, 0.98634, 0.99089, 0.99748, 0.95194, 0.99236, 0.87822, 0.99987, 0.99681, 0.99989, 0.99878, 0.98522], "elapse": 1.7161564996931702, "elapse_list": [0.3066897918470204, 0.07129920786246657, 1.3381674999836832], "engine": "onnxruntime", "model_info": {"det": "PP-OCRv6_small", "cls": "PP-OCRv4_mobile", "rec": "PP-OCRv6_small"}}
