{"txts":["昆山虹桥医院","编号：US00310726","彩超检查报告单","姓名：","病区：","检查项目：产科胎儿彩超检查（中孕）","性别：女","私制：产4","4","年龄：21岁门诊/住院号/体检号：525182","检查日期：2024-09-1514:37:47","超声图像：","话：","母体官须管长度约32m。","航儿须部光“U”形压痕，(FI：须都见血流信号环绕。","始儿腈血流：S/03.53，Pl：1.15.B1：0.72，6率163次/分)","的盘厨着子宫前量，厚度约23m，下域抵达官没内口，或熟度级。","羊水最大保度：52m。","韶几体重：170g±25g","观质：38mm，头图：131mm，披用：109ma、股骨长，22m，联骨长：21ms.","那儿超内测值","官内死一龄儿回声。","一股产银检直：","超声提示：","注：本次超声检查，为肋儿策级检查及部分生长省标测定，不包括系统畸形检查","目前始负析赏状态","官内单活验，中学","胎儿新带绕须一周","大小相当于孕约17400","建议复告"],"boxes":[[[150.0,63.0],[241.0,70.0],[239.0,90.0],[149.0,82.0]],[[25.0,83.0],[101.0,89.0],[99.0,102.0],[24.0,97.0]],[[131.0,77.0],[255.0,87.0],[254.0,105.0],[130.0,95.0]],[[27.0,94.0],[56.0,97.0],[54.0,111.0],[26.0,109.0]],[[28.0,106.0],[54.0,108.0],[53.0,121.0],[27.0,118.0]],[[30.0,116.0],[171.0,125.0],[170.0,139.0],[29.0,129.0]],[[94.0,99.0],[128.0,102.0],[127.0,115.0],[93.0,113.0]],[[94.0,110.0],[136.0,114.0],[135.0,126.0],[93.0,122.0]],[[158.0,116.0],[205.0,119.0],[204.0,131.0],[157.0,128.0]],[[159.0,105.0],[308.0,116.0],[307.0,130.0],[158.0,118.0]],[[224.0,98.0],[339.0,108.0],[337.0,121.0],[223.0,111.0]],[[29.0,131.0],[71.0,134.0],[71.0,148.0],[28.0,145.0]],[[56.0,240.0],[76.0,240.0],[76.0,253.0],[56.0,253.0]],[[38.0,322.0],[123.0,330.0],[122.0,343.0],[37.0,335.0]],[[39.0,313.0],[222.0,330.0],[221.0,343.0],[38.0,326.0]],[[40.0,305.0],[259.0,324.0],[258.0,338.0],[38.0,318.0]],[[43.0,288.0],[259.0,308.0],[258.0,321.0],[42.0,302.0]],[[43.0,296.0],[119.0,304.0],[118.0,317.0],[41.0,309.0]],[[45.0,280.0],[126.0,288.0],[124.0,301.0],[43.0,293.0]],[[47.0,272.0],[292.0,296.0],[291.0,309.0],[46.0,285.0]],[[49.0,265.0],[102.0,270.0],[101.0,282.0],[47.0,277.0]],[[50.0,258.0],[116.0,263.0],[115.0,276.0],[49.0,270.0]],[[57.0,250.0],[105.0,255.0],[103.0,267.0],[55.0,262.0]],[[19.0,332.0],[60.0,336.0],[58.0,350.0],[18.0,346.0]],[[32.0,369.0],[292.0,387.0],[291.0,400.0],[31.0,382.0]],[[33.0,361.0],[100.0,366.0],[99.0,379.0],[32.0,374.0]],[[34.0,345.0],[103.0,350.0],[102.0,363.0],[33.0,358.0]],[[34.0,353.0],[101.0,358.0],[100.0,371.0],[33.0,366.0]],[[107.0,351.0],[184.0,357.0],[183.0,371.0],[106.0,364.0]],[[113.0,367.0],[149.0,370.0],[148.0,382.0],[112.0,379.0]]],"scores":[0.99976,0.92557,0.99883,0.9892,0.81068,0.94271,0.99365,0.60291,0.63483,0.96003,0.99588,0.80636,0.5829,0.84538,0.75138,0.8179,0.80065,0.802,0.79723,0.73203,0.66674,0.67225,0.72179,0.96186,0.78741,0.58317,0.83734,0.69528,0.85884,0.83124],"elapse":0.6626223328057677,"elapse_list":[0.12306054192595184,0.02423345809802413,0.5153283327817917],"engine":"onnxruntime","model_info":{"det":"PP-OCRv6_small","cls":"PP-OCRv4_mobile","rec":"PP-OCRv6_small"}}
