{"txts": ["◆", "◆", "◆", "◆", "◆", "◆", "◆", "1 糖耐量-空腹血糖", "序号 项目名称", "◆", "◆", "◆", "项目名称：糖耐量-空腹血糖，糖耐量-1小时血糖，糖耐量-2小时血糖", "糖耐量-2小时血糖", "糖耐量-1小时血糖", "◆", "◆", "◆", "◆", "2hPG", "1hPG", "FPG", "缩写", "◆", "◆", "◆", "结果", "◆", "◆", "◆", "◆", "◆", "◆", "◆", "◆", "◆", "单位", "◆", "◆", "参考区间", "◆", "◆", "◆", "◆", "◆", "◆", "◆", "◆", "◆", "◆", "◆"], "boxes": [[[31.0, 48.0], [70.0, 47.0], [92.0, 1119.0], [52.0, 1120.0]], [[58.0, 43.0], [97.0, 42.0], [113.0, 879.0], [75.0, 880.0]], [[88.0, 44.0], [124.0, 43.0], [132.0, 544.0], [96.0, 545.0]], [[119.0, 43.0], [155.0, 42.0], [160.0, 383.0], [124.0, 383.0]], [[151.0, 41.0], [186.0, 40.0], [192.0, 381.0], [156.0, 381.0]], [[183.0, 40.0], [219.0, 41.0], [216.0, 104.0], [180.0, 102.0]], [[706.0, 43.0], [738.0, 43.0], [738.0, 88.0], [706.0, 88.0]], [[737.0, 38.0], [770.0, 37.0], [773.0, 276.0], [741.0, 277.0]], [[769.0, 39.0], [806.0, 38.0], [810.0, 210.0], [774.0, 211.0]], [[818.0, 39.0], [855.0, 38.0], [859.0, 159.0], [821.0, 160.0]], [[850.0, 38.0], [888.0, 37.0], [892.0, 144.0], [854.0, 145.0]], [[889.0, 36.0], [926.0, 35.0], [929.0, 181.0], [893.0, 182.0]], [[988.0, 30.0], [1031.0, 29.0], [1045.0, 726.0], [1002.0, 727.0]], [[673.0, 71.0], [709.0, 70.0], [712.0, 289.0], [676.0, 290.0]], [[706.0, 72.0], [739.0, 71.0], [743.0, 287.0], [709.0, 288.0]], [[945.0, 113.0], [1003.0, 112.0], [1014.0, 1284.0], [955.0, 1285.0]], [[827.0, 281.0], [864.0, 281.0], [864.0, 353.0], [827.0, 353.0]], [[864.0, 283.0], [898.0, 282.0], [900.0, 468.0], [867.0, 469.0]], [[898.0, 279.0], [931.0, 278.0], [934.0, 500.0], [901.0, 501.0]], [[678.0, 476.0], [715.0, 476.0], [715.0, 544.0], [678.0, 544.0]], [[710.0, 477.0], [746.0, 477.0], [746.0, 543.0], [710.0, 543.0]], [[744.0, 477.0], [777.0, 477.0], [777.0, 534.0], [744.0, 534.0]], [[776.0, 477.0], [811.0, 477.0], [811.0, 534.0], [776.0, 534.0]], [[683.0, 602.0], [714.0, 602.0], [714.0, 652.0], [683.0, 652.0]], [[715.0, 597.0], [752.0, 597.0], [752.0, 664.0], [715.0, 664.0]], [[742.0, 596.0], [778.0, 595.0], [780.0, 689.0], [745.0, 690.0]], [[779.0, 594.0], [816.0, 594.0], [816.0, 654.0], [779.0, 654.0]], [[99.0, 615.0], [132.0, 614.0], [136.0, 923.0], [103.0, 923.0]], [[127.0, 614.0], [161.0, 614.0], [164.0, 956.0], [130.0, 956.0]], [[159.0, 612.0], [194.0, 612.0], [198.0, 956.0], [162.0, 956.0]], [[836.0, 652.0], [870.0, 652.0], [870.0, 820.0], [836.0, 820.0]], [[872.0, 652.0], [905.0, 652.0], [905.0, 842.0], [872.0, 842.0]], [[906.0, 651.0], [940.0, 651.0], [940.0, 820.0], [906.0, 820.0]], [[681.0, 710.0], [715.0, 710.0], [716.0, 899.0], [682.0, 899.0]], [[713.0, 711.0], [745.0, 710.0], [748.0, 802.0], [716.0, 803.0]], [[747.0, 710.0], [778.0, 710.0], [778.0, 825.0], [747.0, 825.0]], [[780.0, 717.0], [817.0, 717.0], [817.0, 778.0], [780.0, 778.0]], [[715.0, 821.0], [746.0, 821.0], [746.0, 909.0], [715.0, 909.0]], [[747.0, 814.0], [779.0, 814.0], [779.0, 899.0], [747.0, 899.0]], [[777.0, 811.0], [814.0, 810.0], [817.0, 991.0], [780.0, 991.0]], [[816.0, 1069.0], [847.0, 1069.0], [847.0, 1191.0], [816.0, 1191.0]], [[841.0, 1066.0], [873.0, 1066.0], [877.0, 1483.0], [844.0, 1483.0]], [[873.0, 1066.0], [905.0, 1066.0], [905.0, 1327.0], [873.0, 1327.0]], [[903.0, 1063.0], [937.0, 1063.0], [937.0, 1198.0], [903.0, 1198.0]], [[132.0, 1116.0], [164.0, 1116.0], [164.0, 1201.0], [132.0, 1201.0]], [[170.0, 1112.0], [205.0, 1112.0], [205.0, 1199.0], [170.0, 1199.0]], [[685.0, 1170.0], [722.0, 1169.0], [725.0, 1302.0], [687.0, 1303.0]], [[719.0, 1169.0], [755.0, 1169.0], [755.0, 1303.0], [719.0, 1303.0]], [[749.0, 1169.0], [786.0, 1169.0], [786.0, 1302.0], [749.0, 1302.0]], [[781.0, 1204.0], [818.0, 1203.0], [820.0, 1379.0], [783.0, 1379.0]], [[1005.0, 1213.0], [1037.0, 1213.0], [1037.0, 1478.0], [1005.0, 1478.0]]], "scores": [0.99389, 0.99907, 0.99954, 0.99231, 0.99418, 0.99647, 0.50113, 0.96956, 0.96338, 0.99981, 0.98536, 0.99988, 0.96244, 0.99985, 0.99991, 0.99806, 0.96695, 0.99252, 0.99934, 0.99803, 0.98774, 0.99861, 0.99968, 0.99797, 0.99956, 0.95804, 0.99996, 0.99841, 0.99079, 0.97373, 0.9936, 0.99505, 0.99939, 0.9865, 0.9991, 0.9778, 0.99979, 0.99987, 0.99885, 0.99992, 0.9846, 0.96264, 0.99978, 0.99991, 0.997, 0.99716, 0.98039, 0.99797, 0.99433, 0.99412, 0.98893], "elapse": 1.0439812906552106, "elapse_list": [0.26989820785820484, 0.033832332817837596, 0.7402507499791682], "engine": "onnxruntime", "model_info": {"det": "PP-OCRv6_small", "cls": "PP-OCRv4_mobile", "rec": "PP-OCRv6_small"}}
