{"txts": ["◆", "◆", "◆", "◆", "◆", "◆", "◆", "◆", "◆", "◆", "◆", "◆", "◆", "◆", "◆", "◆", "序号 项目名称", "缩写", "结果", "单位", "参考区间", "◆", "1 总25羟基维生素D", "25(OH)D", "5.70", "ng/ml", "<12ng/ml缺乏", "◆", "2", "3", "12-20ng/ml不足", "4", "5", ">20ng/ml正常", "7 铁蛋白测定", "Fer", "30.48", "ng/ml", "4.63~204.00", "◆", "8叶酸测定", "FA", "15.70", "ng/ml", "3.10~20.50", "◆", "9维生素B12测定", "VitB12", "375.00", "pg/mL", "187.00~883.00", "◆", "外Vit1)", "◆", "◆", "◆", "◆", "◆", "◆", "◆", "◆", "◆", "◆"], "boxes": [[[45.0, 59.0], [766.0, 54.0], [767.0, 85.0], [45.0, 90.0]], [[1231.0, 58.0], [1506.0, 56.0], [1506.0, 85.0], [1231.0, 87.0]], [[133.0, 86.0], [1296.0, 84.0], [1296.0, 136.0], [133.0, 138.0]], [[50.0, 161.0], [197.0, 161.0], [197.0, 191.0], [50.0, 191.0]], [[296.0, 160.0], [514.0, 160.0], [514.0, 190.0], [296.0, 190.0]], [[663.0, 153.0], [833.0, 153.0], [833.0, 186.0], [663.0, 186.0]], [[1075.0, 161.0], [1209.0, 161.0], [1209.0, 192.0], [1075.0, 192.0]], [[51.0, 197.0], [154.0, 197.0], [154.0, 230.0], [51.0, 230.0]], [[298.0, 192.0], [481.0, 192.0], [481.0, 224.0], [298.0, 224.0]], [[664.0, 189.0], [832.0, 188.0], [832.0, 218.0], [664.0, 219.0]], [[1078.0, 195.0], [1335.0, 195.0], [1335.0, 221.0], [1078.0, 221.0]], [[51.0, 231.0], [172.0, 231.0], [172.0, 262.0], [51.0, 262.0]], [[295.0, 227.0], [364.0, 227.0], [364.0, 263.0], [295.0, 263.0]], [[662.0, 224.0], [831.0, 222.0], [831.0, 255.0], [663.0, 257.0]], [[1077.0, 222.0], [1515.0, 220.0], [1515.0, 250.0], [1077.0, 252.0]], [[1078.0, 251.0], [1276.0, 251.0], [1276.0, 278.0], [1078.0, 278.0]], [[54.0, 283.0], [223.0, 283.0], [223.0, 313.0], [54.0, 313.0]], [[488.0, 281.0], [547.0, 281.0], [547.0, 315.0], [488.0, 315.0]], [[605.0, 279.0], [663.0, 279.0], [663.0, 313.0], [605.0, 313.0]], [[728.0, 277.0], [786.0, 277.0], [786.0, 310.0], [728.0, 310.0]], [[826.0, 280.0], [999.0, 280.0], [999.0, 313.0], [826.0, 313.0]], [[1250.0, 281.0], [1427.0, 279.0], [1428.0, 312.0], [1250.0, 314.0]], [[57.0, 319.0], [294.0, 319.0], [294.0, 345.0], [57.0, 345.0]], [[491.0, 318.0], [591.0, 318.0], [591.0, 345.0], [491.0, 345.0]], [[608.0, 316.0], [671.0, 313.0], [673.0, 343.0], [610.0, 346.0]], [[721.0, 316.0], [793.0, 316.0], [793.0, 344.0], [721.0, 344.0]], [[834.0, 317.0], [994.0, 317.0], [994.0, 346.0], [834.0, 346.0]], [[1247.0, 314.0], [1510.0, 311.0], [1510.0, 340.0], [1247.0, 344.0]], [[59.0, 351.0], [82.0, 351.0], [82.0, 381.0], [59.0, 381.0]], [[61.0, 385.0], [80.0, 385.0], [80.0, 412.0], [61.0, 412.0]], [[834.0, 381.0], [1018.0, 381.0], [1018.0, 411.0], [834.0, 411.0]], [[62.0, 419.0], [81.0, 419.0], [81.0, 445.0], [62.0, 445.0]], [[61.0, 451.0], [81.0, 451.0], [81.0, 477.0], [61.0, 477.0]], [[831.0, 445.0], [993.0, 445.0], [993.0, 477.0], [831.0, 477.0]], [[60.0, 479.0], [300.0, 479.0], [300.0, 509.0], [60.0, 509.0]], [[485.0, 478.0], [537.0, 478.0], [537.0, 509.0], [485.0, 509.0]], [[609.0, 476.0], [685.0, 476.0], [685.0, 507.0], [609.0, 507.0]], [[716.0, 473.0], [793.0, 473.0], [793.0, 508.0], [716.0, 508.0]], [[830.0, 478.0], [991.0, 478.0], [991.0, 508.0], [830.0, 508.0]], [[1247.0, 475.0], [1510.0, 472.0], [1510.0, 502.0], [1247.0, 504.0]], [[60.0, 512.0], [200.0, 512.0], [200.0, 543.0], [60.0, 543.0]], [[485.0, 510.0], [525.0, 510.0], [525.0, 542.0], [485.0, 542.0]], [[611.0, 510.0], [684.0, 510.0], [684.0, 539.0], [611.0, 539.0]], [[715.0, 507.0], [793.0, 507.0], [793.0, 542.0], [715.0, 542.0]], [[830.0, 512.0], [977.0, 512.0], [977.0, 539.0], [830.0, 539.0]], [[1248.0, 506.0], [1510.0, 506.0], [1510.0, 536.0], [1248.0, 536.0]], [[59.0, 544.0], [265.0, 543.0], [265.0, 574.0], [59.0, 575.0]], [[487.0, 543.0], [575.0, 543.0], [575.0, 574.0], [487.0, 574.0]], [[609.0, 543.0], [695.0, 543.0], [695.0, 571.0], [609.0, 571.0]], [[712.0, 540.0], [792.0, 538.0], [794.0, 572.0], [713.0, 575.0]], [[830.0, 545.0], [1014.0, 545.0], [1014.0, 572.0], [830.0, 572.0]], [[1245.0, 539.0], [1510.0, 537.0], [1510.0, 567.0], [1245.0, 569.0]], [[506.0, 651.0], [679.0, 647.0], [681.0, 735.0], [508.0, 739.0]], [[40.0, 875.0], [104.0, 875.0], [104.0, 906.0], [40.0, 906.0]], [[40.0, 905.0], [379.0, 901.0], [379.0, 931.0], [40.0, 935.0]], [[615.0, 906.0], [954.0, 906.0], [954.0, 935.0], [615.0, 935.0]], [[1116.0, 899.0], [1202.0, 899.0], [1202.0, 934.0], [1116.0, 934.0]], [[40.0, 938.0], [380.0, 934.0], [380.0, 964.0], [40.0, 968.0]], [[615.0, 940.0], [954.0, 940.0], [954.0, 969.0], [615.0, 969.0]], [[40.0, 968.0], [539.0, 962.0], [539.0, 995.0], [40.0, 1001.0]], [[616.0, 969.0], [918.0, 969.0], [918.0, 996.0], [616.0, 996.0]], [[37.0, 993.0], [875.0, 990.0], [875.0, 1025.0], [37.0, 1028.0]], [[45.0, 1020.0], [1121.0, 1014.0], [1121.0, 1050.0], [45.0, 1055.0]]], "scores": [0.95954, 0.99713, 0.9994, 0.9993, 0.99932, 0.99765, 0.99989, 0.99806, 0.995, 0.99945, 0.99993, 0.99996, 0.96581, 0.99975, 0.97941, 0.95866, 0.9516, 0.99969, 0.99992, 0.99968, 0.99994, 0.9997, 0.99378, 0.94637, 0.99999, 0.99247, 0.96767, 0.99896, 0.99981, 0.99987, 0.99465, 0.99997, 0.99998, 0.99901, 0.95735, 0.9988, 0.99992, 0.99899, 0.99634, 0.99969, 0.9997, 0.99954, 0.99998, 0.99321, 0.99937, 0.99964, 0.99984, 0.99898, 0.99998, 0.99971, 0.99215, 0.99977, 0.75479, 0.97883, 0.98096, 0.98807, 0.99731, 0.9851, 0.99415, 0.99996, 0.99265, 0.99983, 0.99695], "elapse": 1.2227675407193601, "elapse_list": [0.270312582841143, 0.0406097499653697, 0.9118452079128474], "engine": "onnxruntime", "model_info": {"det": "PP-OCRv6_small", "cls": "PP-OCRv4_mobile", "rec": "PP-OCRv6_small"}}
